"No.","Time","Source","Destination","Protocol","Length","Info"
"1","0.000000","192.168.1.164","142.104.5.64","TCP","62","1200  >  80 [SYN] Seq=0 Win=16384 Len=0 MSS=1460 SACK_PERM"
"2","0.002812","142.104.5.64","192.168.1.164","TCP","60","80  >  1200 [SYN, ACK] Seq=0 Ack=1 Win=17520 Len=0 MSS=1460"
"3","0.002835","192.168.1.164","142.104.5.64","TCP","54","1200  >  80 [ACK] Seq=1 Ack=1 Win=17520 Len=0"
"4","0.002916","192.168.1.164","142.104.5.64","HTTP","473","GET /index.html HTTP/1.1 "
"5","0.015346","142.104.5.64","192.168.1.164","TCP","1514","80  >  1200 [ACK] Seq=1 Ack=420 Win=17520 Len=1460 [TCP segment of a reassembled PDU]"
"6","0.016755","142.104.5.64","192.168.1.164","TCP","1514","80  >  1200 [ACK] Seq=1461 Ack=420 Win=17520 Len=1460 [TCP segment of a reassembled PDU]"
"7","0.016776","192.168.1.164","142.104.5.64","TCP","54","1200  >  80 [ACK] Seq=420 Ack=2921 Win=17520 Len=0"
"8","0.018250","142.104.5.64","192.168.1.164","TCP","1514","80  >  1200 [ACK] Seq=2921 Ack=420 Win=17520 Len=1460 [TCP segment of a reassembled PDU]"
"9","0.025730","142.104.5.64","192.168.1.164","TCP","1514","80  >  1200 [ACK] Seq=4381 Ack=420 Win=17520 Len=1460 [TCP segment of a reassembled PDU]"
"10","0.025753","192.168.1.164","142.104.5.64","TCP","54","1200  >  80 [ACK] Seq=420 Ack=5841 Win=17520 Len=0"
"11","0.027093","142.104.5.64","192.168.1.164","TCP","1514","80  >  1200 [ACK] Seq=5841 Ack=420 Win=17520 Len=1460 [TCP segment of a reassembled PDU]"
"12","0.030109","142.104.5.64","192.168.1.164","TCP","1514","80  >  1200 [ACK] Seq=7301 Ack=420 Win=17520 Len=1460 [TCP segment of a reassembled PDU]"
"13","0.030129","192.168.1.164","142.104.5.64","TCP","54","1200  >  80 [ACK] Seq=420 Ack=8761 Win=17520 Len=0"
"14","0.034411","142.104.5.64","192.168.1.164","TCP","1514","80  >  1200 [ACK] Seq=8761 Ack=420 Win=17520 Len=1460 [TCP segment of a reassembled PDU]"
"15","0.034432","192.168.1.164","142.104.5.64","TCP","54","1200  >  80 [ACK] Seq=420 Ack=10221 Win=16060 Len=0"
"16","0.035788","142.104.5.64","192.168.1.164","TCP","1514","80  >  1200 [ACK] Seq=10221 Ack=420 Win=17520 Len=1460 [TCP segment of a reassembled PDU]"
"17","0.037570","142.104.5.64","192.168.1.164","TCP","1514","80  >  1200 [ACK] Seq=11681 Ack=420 Win=17520 Len=1460 [TCP segment of a reassembled PDU]"
"18","0.037583","192.168.1.164","142.104.5.64","TCP","54","1200  >  80 [ACK] Seq=420 Ack=13141 Win=13140 Len=0"
"19","0.039063","142.104.5.64","192.168.1.164","TCP","1514","80  >  1200 [ACK] Seq=13141 Ack=420 Win=17520 Len=1460 [TCP segment of a reassembled PDU]"
"20","0.040795","142.104.5.64","192.168.1.164","HTTP","1426","HTTP/1.1 200 OK  (text/html)"
"21","0.040811","192.168.1.164","142.104.5.64","TCP","54","1200  >  80 [ACK] Seq=420 Ack=15973 Win=10308 Len=0"
"22","0.291372","192.168.1.164","142.104.5.64","TCP","54","[TCP Window Update] 1200  >  80 [ACK] Seq=420 Ack=15973 Win=17520 Len=0"
"23","2.607847","192.168.1.164","142.104.5.64","HTTP","491","GET /about/welcome.html HTTP/1.1 "
"24","2.632146","142.104.5.64","192.168.1.164","TCP","1514","80  >  1200 [ACK] Seq=15973 Ack=857 Win=17520 Len=1460 [TCP segment of a reassembled PDU]"
"25","2.633580","142.104.5.64","192.168.1.164","TCP","1514","80  >  1200 [ACK] Seq=17433 Ack=857 Win=17520 Len=1460 [TCP segment of a reassembled PDU]"
"26","2.633599","192.168.1.164","142.104.5.64","TCP","54","1200  >  80 [ACK] Seq=857 Ack=18893 Win=17520 Len=0"
"27","2.635054","142.104.5.64","192.168.1.164","TCP","1514","80  >  1200 [ACK] Seq=18893 Ack=857 Win=17520 Len=1460 [TCP segment of a reassembled PDU]"
"28","2.636436","142.104.5.64","192.168.1.164","TCP","1514","80  >  1200 [ACK] Seq=20353 Ack=857 Win=17520 Len=1460 [TCP segment of a reassembled PDU]"
"29","2.636450","192.168.1.164","142.104.5.64","TCP","54","1200  >  80 [ACK] Seq=857 Ack=21813 Win=17520 Len=0"
"30","2.638154","142.104.5.64","192.168.1.164","TCP","1514","80  >  1200 [ACK] Seq=21813 Ack=857 Win=17520 Len=1460 [TCP segment of a reassembled PDU]"
"31","2.639974","142.104.5.64","192.168.1.164","TCP","1514","80  >  1200 [ACK] Seq=23273 Ack=857 Win=17520 Len=1460 [TCP segment of a reassembled PDU]"
"32","2.639988","192.168.1.164","142.104.5.64","TCP","54","1200  >  80 [ACK] Seq=857 Ack=24733 Win=17520 Len=0"
"33","2.641453","142.104.5.64","192.168.1.164","TCP","1514","80  >  1200 [ACK] Seq=24733 Ack=857 Win=17520 Len=1460 [TCP segment of a reassembled PDU]"
"34","2.641471","192.168.1.164","142.104.5.64","TCP","54","1200  >  80 [ACK] Seq=857 Ack=26193 Win=16060 Len=0"
"35","2.643176","142.104.5.64","192.168.1.164","TCP","1514","80  >  1200 [ACK] Seq=26193 Ack=857 Win=17520 Len=1460 [TCP segment of a reassembled PDU]"
"36","2.644653","142.104.5.64","192.168.1.164","TCP","1514","80  >  1200 [ACK] Seq=27653 Ack=857 Win=17520 Len=1460 [TCP segment of a reassembled PDU]"
"37","2.644666","192.168.1.164","142.104.5.64","TCP","54","1200  >  80 [ACK] Seq=857 Ack=29113 Win=13140 Len=0"
"38","2.653198","192.168.1.164","142.104.5.64","TCP","54","[TCP Window Update] 1200  >  80 [ACK] Seq=857 Ack=29113 Win=17520 Len=0"
"39","2.654450","142.104.5.64","192.168.1.164","TCP","1514","80  >  1200 [ACK] Seq=29113 Ack=857 Win=17520 Len=1460 [TCP segment of a reassembled PDU]"
"40","2.658101","142.104.5.64","192.168.1.164","TCP","1514","80  >  1200 [ACK] Seq=30573 Ack=857 Win=17520 Len=1460 [TCP segment of a reassembled PDU]"
"41","2.658127","192.168.1.164","142.104.5.64","TCP","54","1200  >  80 [ACK] Seq=857 Ack=32033 Win=17520 Len=0"
"42","2.659628","142.104.5.64","192.168.1.164","HTTP","544","HTTP/1.1 200 OK  (text/html)"
"43","2.669554","192.168.1.164","142.104.5.64","TCP","62","1201  >  80 [SYN] Seq=0 Win=16384 Len=0 MSS=1460 SACK_PERM"
"44","2.682610","142.104.5.64","192.168.1.164","TCP","60","80  >  1201 [SYN, ACK] Seq=0 Ack=1 Win=17520 Len=0 MSS=1460"
"45","2.682672","192.168.1.164","142.104.5.64","TCP","54","1201  >  80 [ACK] Seq=1 Ack=1 Win=17520 Len=0"
"46","2.682800","192.168.1.164","142.104.5.64","HTTP","347","GET /assets/photos/president.jpg HTTP/1.1 "
"47","2.695080","142.104.5.64","192.168.1.164","TCP","1514","80  >  1201 [ACK] Seq=1 Ack=294 Win=17520 Len=1460 [TCP segment of a reassembled PDU]"
"48","2.696407","142.104.5.64","192.168.1.164","TCP","1514","80  >  1201 [ACK] Seq=1461 Ack=294 Win=17520 Len=1460 [TCP segment of a reassembled PDU]"
"49","2.696432","192.168.1.164","142.104.5.64","TCP","54","1201  >  80 [ACK] Seq=294 Ack=2921 Win=17520 Len=0"
"50","2.697782","142.104.5.64","192.168.1.164","TCP","1514","80  >  1201 [ACK] Seq=2921 Ack=294 Win=17520 Len=1460 [TCP segment of a reassembled PDU]"
"51","2.705228","142.104.5.64","192.168.1.164","TCP","1514","80  >  1201 [ACK] Seq=4381 Ack=294 Win=17520 Len=1460 [TCP segment of a reassembled PDU]"
"52","2.705273","192.168.1.164","142.104.5.64","TCP","54","1201  >  80 [ACK] Seq=294 Ack=5841 Win=17520 Len=0"
"53","2.706019","192.168.1.164","142.104.5.64","HTTP","340","GET /assets/images/up.gif HTTP/1.1 "
"54","2.706712","142.104.5.64","192.168.1.164","TCP","1514","80  >  1201 [ACK] Seq=5841 Ack=294 Win=17520 Len=1460 [TCP segment of a reassembled PDU]"
"55","2.708483","142.104.5.64","192.168.1.164","TCP","1514","80  >  1201 [ACK] Seq=7301 Ack=294 Win=17520 Len=1460 [TCP segment of a reassembled PDU]"
"56","2.708504","192.168.1.164","142.104.5.64","TCP","54","1201  >  80 [ACK] Seq=294 Ack=8761 Win=17520 Len=0"
"57","2.714155","142.104.5.64","192.168.1.164","TCP","1514","80  >  1201 [ACK] Seq=8761 Ack=294 Win=17520 Len=1460 [TCP segment of a reassembled PDU]"
"58","2.715583","142.104.5.64","192.168.1.164","TCP","1514","80  >  1201 [ACK] Seq=10221 Ack=294 Win=17520 Len=1460 [TCP segment of a reassembled PDU]"
"59","2.715607","192.168.1.164","142.104.5.64","TCP","54","1201  >  80 [ACK] Seq=294 Ack=11681 Win=17520 Len=0"
"60","2.717024","142.104.5.64","192.168.1.164","TCP","1514","80  >  1201 [ACK] Seq=11681 Ack=294 Win=17520 Len=1460 [TCP segment of a reassembled PDU]"
"61","2.719236","142.104.5.64","192.168.1.164","TCP","1514","80  >  1201 [ACK] Seq=13141 Ack=294 Win=17520 Len=1460 [TCP segment of a reassembled PDU]"
"62","2.719262","192.168.1.164","142.104.5.64","TCP","54","1201  >  80 [ACK] Seq=294 Ack=14601 Win=17520 Len=0"
"63","2.720672","142.104.5.64","192.168.1.164","TCP","1514","80  >  1201 [ACK] Seq=14601 Ack=294 Win=17520 Len=1460 [TCP segment of a reassembled PDU]"
"64","2.722483","142.104.5.64","192.168.1.164","TCP","1514","80  >  1201 [ACK] Seq=16061 Ack=294 Win=17520 Len=1460 [TCP segment of a reassembled PDU]"
"65","2.722567","192.168.1.164","142.104.5.64","TCP","54","1201  >  80 [ACK] Seq=294 Ack=17521 Win=17520 Len=0"
"66","2.723123","142.104.5.64","192.168.1.164","HTTP","453","HTTP/1.1 200 OK  (GIF89a)"
"67","2.725364","192.168.1.164","142.104.5.64","HTTP","344","GET /assets/images/bullet.gif HTTP/1.1 "
"68","2.730159","142.104.5.64","192.168.1.164","TCP","1514","80  >  1201 [ACK] Seq=17521 Ack=294 Win=17520 Len=1460 [TCP segment of a reassembled PDU]"
"69","2.732155","142.104.5.64","192.168.1.164","HTTP","816","HTTP/1.1 200 OK  (JPEG JFIF image)"
"70","2.732204","192.168.1.164","142.104.5.64","TCP","54","1201  >  80 [ACK] Seq=294 Ack=19743 Win=17520 Len=0"
"71","2.756852","142.104.5.64","192.168.1.164","TCP","60","80  >  1200 [ACK] Seq=32922 Ack=1433 Win=17230 Len=0"
"72","2.791051","142.104.5.64","192.168.1.164","HTTP","391","HTTP/1.1 200 OK  (GIF89a)"
"73","2.923682","192.168.1.164","142.104.5.64","TCP","54","1200  >  80 [ACK] Seq=1433 Ack=33259 Win=16294 Len=0"
"74","6.335747","192.168.1.164","142.104.5.64","HTTP","497","GET /staff/index.html HTTP/1.1 "
"75","6.348416","142.104.5.64","192.168.1.164","TCP","1514","80  >  1201 [ACK] Seq=19743 Ack=737 Win=17520 Len=1460 [TCP segment of a reassembled PDU]"
"76","6.349822","142.104.5.64","192.168.1.164","TCP","1514","80  >  1201 [ACK] Seq=21203 Ack=737 Win=17520 Len=1460 [TCP segment of a reassembled PDU]"
"77","6.349845","192.168.1.164","142.104.5.64","TCP","54","1201  >  80 [ACK] Seq=737 Ack=22663 Win=17520 Len=0"
"78","6.351262","142.104.5.64","192.168.1.164","TCP","1514","80  >  1201 [ACK] Seq=22663 Ack=737 Win=17520 Len=1460 [TCP segment of a reassembled PDU]"
"79","6.353071","142.104.5.64","192.168.1.164","TCP","1514","80  >  1201 [ACK] Seq=24123 Ack=737 Win=17520 Len=1460 [TCP segment of a reassembled PDU]"
"80","6.353105","192.168.1.164","142.104.5.64","TCP","54","1201  >  80 [ACK] Seq=737 Ack=25583 Win=17520 Len=0"
"81","6.354494","142.104.5.64","192.168.1.164","TCP","1514","80  >  1201 [ACK] Seq=25583 Ack=737 Win=17520 Len=1460 [TCP segment of a reassembled PDU]"
"82","6.356325","142.104.5.64","192.168.1.164","TCP","1514","80  >  1201 [ACK] Seq=27043 Ack=737 Win=17520 Len=1460 [TCP segment of a reassembled PDU]"
"83","6.356357","192.168.1.164","142.104.5.64","TCP","54","1201  >  80 [ACK] Seq=737 Ack=28503 Win=17520 Len=0"
"84","6.357701","142.104.5.64","192.168.1.164","TCP","1514","80  >  1201 [ACK] Seq=28503 Ack=737 Win=17520 Len=1460 [TCP segment of a reassembled PDU]"
"85","6.359442","142.104.5.64","192.168.1.164","TCP","1514","80  >  1201 [ACK] Seq=29963 Ack=737 Win=17520 Len=1460 [TCP segment of a reassembled PDU]"
"86","6.359469","192.168.1.164","142.104.5.64","TCP","54","1201  >  80 [ACK] Seq=737 Ack=31423 Win=17520 Len=0"
"87","6.360858","142.104.5.64","192.168.1.164","TCP","1514","80  >  1201 [ACK] Seq=31423 Ack=737 Win=17520 Len=1460 [TCP segment of a reassembled PDU]"
"88","6.362605","142.104.5.64","192.168.1.164","TCP","1514","80  >  1201 [ACK] Seq=32883 Ack=737 Win=17520 Len=1460 [TCP segment of a reassembled PDU]"
"89","6.362632","192.168.1.164","142.104.5.64","TCP","54","1201  >  80 [ACK] Seq=737 Ack=34343 Win=17520 Len=0"
"90","6.364021","142.104.5.64","192.168.1.164","TCP","1514","80  >  1201 [ACK] Seq=34343 Ack=737 Win=17520 Len=1460 [TCP segment of a reassembled PDU]"
"91","6.364054","192.168.1.164","142.104.5.64","TCP","54","1201  >  80 [ACK] Seq=737 Ack=35803 Win=17520 Len=0"
"92","6.365789","142.104.5.64","192.168.1.164","TCP","1514","80  >  1201 [PSH, ACK] Seq=35803 Ack=737 Win=17520 Len=1460 [TCP segment of a reassembled PDU]"
"93","6.368398","192.168.1.164","142.104.5.64","HTTP","354","GET /assets/headerphotos/staff-banner.jpg HTTP/1.1 "
"94","6.369903","142.104.5.64","192.168.1.164","TCP","1514","80  >  1201 [ACK] Seq=37263 Ack=737 Win=17520 Len=1460 [TCP segment of a reassembled PDU]"
"95","6.369927","192.168.1.164","142.104.5.64","TCP","54","1201  >  80 [ACK] Seq=737 Ack=38723 Win=17520 Len=0"
"96","6.371931","142.104.5.64","192.168.1.164","TCP","1514","80  >  1201 [ACK] Seq=38723 Ack=737 Win=17520 Len=1460 [TCP segment of a reassembled PDU]"
"97","6.373693","142.104.5.64","192.168.1.164","TCP","1514","80  >  1201 [ACK] Seq=40183 Ack=737 Win=17520 Len=1460 [TCP segment of a reassembled PDU]"
"98","6.373714","192.168.1.164","142.104.5.64","TCP","54","1201  >  80 [ACK] Seq=737 Ack=41643 Win=17520 Len=0"
"99","6.375121","142.104.5.64","192.168.1.164","TCP","1514","80  >  1201 [ACK] Seq=41643 Ack=737 Win=17520 Len=1460 [TCP segment of a reassembled PDU]"
"100","6.376856","142.104.5.64","192.168.1.164","TCP","1514","80  >  1201 [ACK] Seq=43103 Ack=737 Win=17520 Len=1460 [TCP segment of a reassembled PDU]"
"101","6.376879","192.168.1.164","142.104.5.64","TCP","54","1201  >  80 [ACK] Seq=737 Ack=44563 Win=17520 Len=0"
"102","6.378002","142.104.5.64","192.168.1.164","HTTP","1078","HTTP/1.1 200 OK  (text/html)"
"103","6.382278","142.104.5.64","192.168.1.164","TCP","1514","80  >  1200 [ACK] Seq=33259 Ack=1733 Win=17520 Len=1460 [TCP segment of a reassembled PDU]"
"104","6.383756","142.104.5.64","192.168.1.164","TCP","1514","80  >  1200 [ACK] Seq=34719 Ack=1733 Win=17520 Len=1460 [TCP segment of a reassembled PDU]"
"105","6.383777","192.168.1.164","142.104.5.64","TCP","54","1200  >  80 [ACK] Seq=1733 Ack=36179 Win=17520 Len=0"
"106","6.385203","142.104.5.64","192.168.1.164","TCP","1514","80  >  1200 [ACK] Seq=36179 Ack=1733 Win=17520 Len=1460 [TCP segment of a reassembled PDU]"
"107","6.386964","142.104.5.64","192.168.1.164","TCP","1514","80  >  1200 [ACK] Seq=37639 Ack=1733 Win=17520 Len=1460 [TCP segment of a reassembled PDU]"
"108","6.386990","192.168.1.164","142.104.5.64","TCP","54","1200  >  80 [ACK] Seq=1733 Ack=39099 Win=17520 Len=0"
"109","6.388367","142.104.5.64","192.168.1.164","TCP","1514","80  >  1200 [ACK] Seq=39099 Ack=1733 Win=17520 Len=1460 [TCP segment of a reassembled PDU]"
"110","6.390111","142.104.5.64","192.168.1.164","TCP","1514","80  >  1200 [ACK] Seq=40559 Ack=1733 Win=17520 Len=1460 [TCP segment of a reassembled PDU]"
"111","6.390137","192.168.1.164","142.104.5.64","TCP","54","1200  >  80 [ACK] Seq=1733 Ack=42019 Win=17520 Len=0"
"112","6.391000","142.104.5.64","192.168.1.164","HTTP","740","HTTP/1.1 200 OK  (JPEG JFIF image)"
"113","6.421515","192.168.1.164","142.104.5.64","HTTP","344","GET /assets/images/grey-bar.gif HTTP/1.1 "
"114","6.429602","142.104.5.64","192.168.1.164","HTTP","630","HTTP/1.1 200 OK  (GIF89a)"
"115","6.528564","192.168.1.164","142.104.5.64","TCP","54","1200  >  80 [ACK] Seq=1733 Ack=42705 Win=16834 Len=0"
"116","6.628682","192.168.1.164","142.104.5.64","TCP","54","1201  >  80 [ACK] Seq=1027 Ack=46163 Win=17520 Len=0"
"117","10.127886","192.168.1.164","142.104.5.64","HTTP","498","GET /academic/index.html HTTP/1.1 "
"118","10.146296","142.104.5.64","192.168.1.164","TCP","1514","80  >  1200 [ACK] Seq=42705 Ack=2177 Win=17520 Len=1460 [TCP segment of a reassembled PDU]"
"119","10.148416","142.104.5.64","192.168.1.164","TCP","1514","80  >  1200 [ACK] Seq=44165 Ack=2177 Win=17520 Len=1460 [TCP segment of a reassembled PDU]"
"120","10.148449","192.168.1.164","142.104.5.64","TCP","54","1200  >  80 [ACK] Seq=2177 Ack=45625 Win=17520 Len=0"
"121","10.149881","142.104.5.64","192.168.1.164","TCP","1514","80  >  1200 [ACK] Seq=45625 Ack=2177 Win=17520 Len=1460 [TCP segment of a reassembled PDU]"
"122","10.151705","142.104.5.64","192.168.1.164","TCP","1514","80  >  1200 [ACK] Seq=47085 Ack=2177 Win=17520 Len=1460 [TCP segment of a reassembled PDU]"
"123","10.151734","192.168.1.164","142.104.5.64","TCP","54","1200  >  80 [ACK] Seq=2177 Ack=48545 Win=17520 Len=0"
"124","10.153123","142.104.5.64","192.168.1.164","TCP","1514","80  >  1200 [ACK] Seq=48545 Ack=2177 Win=17520 Len=1460 [TCP segment of a reassembled PDU]"
"125","10.155006","142.104.5.64","192.168.1.164","TCP","1514","80  >  1200 [ACK] Seq=50005 Ack=2177 Win=17520 Len=1460 [TCP segment of a reassembled PDU]"
"126","10.155035","192.168.1.164","142.104.5.64","TCP","54","1200  >  80 [ACK] Seq=2177 Ack=51465 Win=17520 Len=0"
"127","10.157862","142.104.5.64","192.168.1.164","TCP","1514","80  >  1200 [ACK] Seq=51465 Ack=2177 Win=17520 Len=1460 [TCP segment of a reassembled PDU]"
"128","10.160256","142.104.5.64","192.168.1.164","TCP","1514","80  >  1200 [ACK] Seq=52925 Ack=2177 Win=17520 Len=1460 [TCP segment of a reassembled PDU]"
"129","10.160292","192.168.1.164","142.104.5.64","TCP","54","1200  >  80 [ACK] Seq=2177 Ack=54385 Win=17520 Len=0"
"130","10.162768","142.104.5.64","192.168.1.164","TCP","1514","80  >  1200 [ACK] Seq=54385 Ack=2177 Win=17520 Len=1460 [TCP segment of a reassembled PDU]"
"131","10.164268","142.104.5.64","192.168.1.164","TCP","1514","80  >  1200 [ACK] Seq=55845 Ack=2177 Win=17520 Len=1460 [TCP segment of a reassembled PDU]"
"132","10.164290","192.168.1.164","142.104.5.64","TCP","54","1200  >  80 [ACK] Seq=2177 Ack=57305 Win=17520 Len=0"
"133","10.165682","142.104.5.64","192.168.1.164","TCP","1514","80  >  1200 [ACK] Seq=57305 Ack=2177 Win=17520 Len=1460 [TCP segment of a reassembled PDU]"
"134","10.167034","192.168.1.164","142.104.5.64","HTTP","362","GET /assets/sectionheader-photos/faculties.jpg HTTP/1.1 "
"135","10.167507","142.104.5.64","192.168.1.164","TCP","1514","80  >  1200 [PSH, ACK] Seq=58765 Ack=2177 Win=17520 Len=1460 [TCP segment of a reassembled PDU]"
"136","10.167524","192.168.1.164","142.104.5.64","TCP","54","1200  >  80 [ACK] Seq=2177 Ack=60225 Win=17520 Len=0"
"137","10.169855","142.104.5.64","192.168.1.164","HTTP","787","HTTP/1.1 200 OK  (text/html)"
"138","10.200026","142.104.5.64","192.168.1.164","TCP","1514","80  >  1201 [ACK] Seq=46163 Ack=1335 Win=17520 Len=1460 [TCP segment of a reassembled PDU]"
"139","10.202600","142.104.5.64","192.168.1.164","TCP","1514","80  >  1201 [ACK] Seq=47623 Ack=1335 Win=17520 Len=1460 [TCP segment of a reassembled PDU]"
"140","10.202627","192.168.1.164","142.104.5.64","TCP","54","1201  >  80 [ACK] Seq=1335 Ack=49083 Win=17520 Len=0"
"141","10.208745","142.104.5.64","192.168.1.164","TCP","1514","80  >  1201 [ACK] Seq=49083 Ack=1335 Win=17520 Len=1460 [TCP segment of a reassembled PDU]"
"142","10.210564","142.104.5.64","192.168.1.164","TCP","1514","80  >  1201 [ACK] Seq=50543 Ack=1335 Win=17520 Len=1460 [TCP segment of a reassembled PDU]"
"143","10.210579","192.168.1.164","142.104.5.64","TCP","54","1201  >  80 [ACK] Seq=1335 Ack=52003 Win=17520 Len=0"
"144","10.211559","142.104.5.64","192.168.1.164","HTTP","1026","HTTP/1.1 200 OK  (JPEG JFIF image)"
"145","10.334044","192.168.1.164","142.104.5.64","TCP","54","1201  >  80 [ACK] Seq=1335 Ack=52975 Win=16548 Len=0"
"146","10.334087","192.168.1.164","142.104.5.64","TCP","54","1200  >  80 [ACK] Seq=2177 Ack=60958 Win=16787 Len=0"
"147","22.154157","192.168.1.164","142.104.5.64","HTTP","505","GET /academic/faculties.html HTTP/1.1 "
"148","22.166927","142.104.5.64","192.168.1.164","TCP","1514","80  >  1200 [ACK] Seq=60958 Ack=2628 Win=17520 Len=1460 [TCP segment of a reassembled PDU]"
"149","22.168423","142.104.5.64","192.168.1.164","TCP","1514","80  >  1200 [ACK] Seq=62418 Ack=2628 Win=17520 Len=1460 [TCP segment of a reassembled PDU]"
"150","22.168450","192.168.1.164","142.104.5.64","TCP","54","1200  >  80 [ACK] Seq=2628 Ack=63878 Win=17520 Len=0"
"151","22.169877","142.104.5.64","192.168.1.164","TCP","1514","80  >  1200 [ACK] Seq=63878 Ack=2628 Win=17520 Len=1460 [TCP segment of a reassembled PDU]"
"152","22.171638","142.104.5.64","192.168.1.164","TCP","1514","80  >  1200 [ACK] Seq=65338 Ack=2628 Win=17520 Len=1460 [TCP segment of a reassembled PDU]"
"153","22.171664","192.168.1.164","142.104.5.64","TCP","54","1200  >  80 [ACK] Seq=2628 Ack=66798 Win=17520 Len=0"
"154","22.173079","142.104.5.64","192.168.1.164","TCP","1514","80  >  1200 [ACK] Seq=66798 Ack=2628 Win=17520 Len=1460 [TCP segment of a reassembled PDU]"
"155","22.174899","142.104.5.64","192.168.1.164","TCP","1514","80  >  1200 [ACK] Seq=68258 Ack=2628 Win=17520 Len=1460 [TCP segment of a reassembled PDU]"
"156","22.174925","192.168.1.164","142.104.5.64","TCP","54","1200  >  80 [ACK] Seq=2628 Ack=69718 Win=17520 Len=0"
"157","22.176301","142.104.5.64","192.168.1.164","TCP","1514","80  >  1200 [ACK] Seq=69718 Ack=2628 Win=17520 Len=1460 [TCP segment of a reassembled PDU]"
"158","22.177675","142.104.5.64","192.168.1.164","TCP","1514","80  >  1200 [ACK] Seq=71178 Ack=2628 Win=17520 Len=1460 [TCP segment of a reassembled PDU]"
"159","22.177701","192.168.1.164","142.104.5.64","TCP","54","1200  >  80 [ACK] Seq=2628 Ack=72638 Win=17520 Len=0"
"160","22.179460","142.104.5.64","192.168.1.164","TCP","1514","80  >  1200 [ACK] Seq=72638 Ack=2628 Win=17520 Len=1460 [TCP segment of a reassembled PDU]"
"161","22.180836","142.104.5.64","192.168.1.164","TCP","1514","80  >  1200 [ACK] Seq=74098 Ack=2628 Win=17520 Len=1460 [TCP segment of a reassembled PDU]"
"162","22.180861","192.168.1.164","142.104.5.64","TCP","54","1200  >  80 [ACK] Seq=2628 Ack=75558 Win=17520 Len=0"
"163","22.182561","142.104.5.64","192.168.1.164","TCP","1514","80  >  1200 [ACK] Seq=75558 Ack=2628 Win=17520 Len=1460 [TCP segment of a reassembled PDU]"
"164","22.182593","192.168.1.164","142.104.5.64","TCP","54","1200  >  80 [ACK] Seq=2628 Ack=77018 Win=17520 Len=0"
"165","22.183977","142.104.5.64","192.168.1.164","TCP","1514","80  >  1200 [PSH, ACK] Seq=77018 Ack=2628 Win=17520 Len=1460 [TCP segment of a reassembled PDU]"
"166","22.187916","142.104.5.64","192.168.1.164","TCP","1514","80  >  1200 [ACK] Seq=78478 Ack=2628 Win=17520 Len=1460 [TCP segment of a reassembled PDU]"
"167","22.187944","192.168.1.164","142.104.5.64","TCP","54","1200  >  80 [ACK] Seq=2628 Ack=79938 Win=17520 Len=0"
"168","22.190669","142.104.5.64","192.168.1.164","TCP","1514","80  >  1200 [ACK] Seq=79938 Ack=2628 Win=17520 Len=1460 [TCP segment of a reassembled PDU]"
"169","22.200344","142.104.5.64","192.168.1.164","TCP","1514","80  >  1200 [ACK] Seq=81398 Ack=2628 Win=17520 Len=1460 [TCP segment of a reassembled PDU]"
"170","22.200395","192.168.1.164","142.104.5.64","TCP","54","1200  >  80 [ACK] Seq=2628 Ack=82858 Win=17520 Len=0"
"171","22.201832","142.104.5.64","192.168.1.164","TCP","1514","80  >  1200 [ACK] Seq=82858 Ack=2628 Win=17520 Len=1460 [TCP segment of a reassembled PDU]"
"172","22.203571","142.104.5.64","192.168.1.164","TCP","1514","80  >  1200 [ACK] Seq=84318 Ack=2628 Win=17520 Len=1460 [TCP segment of a reassembled PDU]"
"173","22.203590","192.168.1.164","142.104.5.64","TCP","54","1200  >  80 [ACK] Seq=2628 Ack=85778 Win=17520 Len=0"
"174","22.204970","142.104.5.64","192.168.1.164","TCP","1514","80  >  1200 [PSH, ACK] Seq=85778 Ack=2628 Win=17520 Len=1460 [TCP segment of a reassembled PDU]"
"175","22.206729","142.104.5.64","192.168.1.164","TCP","1514","80  >  1200 [ACK] Seq=87238 Ack=2628 Win=17520 Len=1460 [TCP segment of a reassembled PDU]"
"176","22.206748","192.168.1.164","142.104.5.64","TCP","54","1200  >  80 [ACK] Seq=2628 Ack=88698 Win=17520 Len=0"
"177","22.208128","142.104.5.64","192.168.1.164","TCP","1514","80  >  1200 [ACK] Seq=88698 Ack=2628 Win=17520 Len=1460 [TCP segment of a reassembled PDU]"
"178","22.211518","142.104.5.64","192.168.1.164","TCP","1514","80  >  1200 [ACK] Seq=90158 Ack=2628 Win=17520 Len=1460 [TCP segment of a reassembled PDU]"
"179","22.211540","192.168.1.164","142.104.5.64","TCP","54","1200  >  80 [ACK] Seq=2628 Ack=91618 Win=17520 Len=0"
"180","22.213011","142.104.5.64","192.168.1.164","TCP","1514","80  >  1200 [PSH, ACK] Seq=91618 Ack=2628 Win=17520 Len=1460 [TCP segment of a reassembled PDU]"
"181","22.214485","142.104.5.64","192.168.1.164","TCP","989","80  >  1200 [PSH, ACK] Seq=93078 Ack=2628 Win=17520 Len=935 [TCP segment of a reassembled PDU]"
"182","22.214505","192.168.1.164","142.104.5.64","TCP","54","1200  >  80 [ACK] Seq=2628 Ack=94013 Win=17520 Len=0"
"183","22.215833","142.104.5.64","192.168.1.164","TCP","1514","80  >  1200 [ACK] Seq=94013 Ack=2628 Win=17520 Len=1460 [TCP segment of a reassembled PDU]"
"184","22.217579","142.104.5.64","192.168.1.164","TCP","1514","80  >  1200 [ACK] Seq=95473 Ack=2628 Win=17520 Len=1460 [TCP segment of a reassembled PDU]"
"185","22.217600","192.168.1.164","142.104.5.64","TCP","54","1200  >  80 [ACK] Seq=2628 Ack=96933 Win=17520 Len=0"
"186","22.219095","142.104.5.64","192.168.1.164","TCP","1514","80  >  1200 [ACK] Seq=96933 Ack=2628 Win=17520 Len=1460 [TCP segment of a reassembled PDU]"
"187","22.220857","142.104.5.64","192.168.1.164","TCP","1514","80  >  1200 [ACK] Seq=98393 Ack=2628 Win=17520 Len=1460 [TCP segment of a reassembled PDU]"
"188","22.220878","192.168.1.164","142.104.5.64","TCP","54","1200  >  80 [ACK] Seq=2628 Ack=99853 Win=17520 Len=0"
"189","22.221250","142.104.5.64","192.168.1.164","HTTP","281","HTTP/1.1 200 OK  (text/html)"
"190","22.351323","192.168.1.164","142.104.5.64","TCP","54","1200  >  80 [ACK] Seq=2628 Ack=100080 Win=17293 Len=0"
"191","26.506923","142.104.5.64","192.168.1.164","TCP","60","80  >  1201 [FIN, ACK] Seq=52975 Ack=1335 Win=17520 Len=0"
"192","26.506981","192.168.1.164","142.104.5.64","TCP","54","1201  >  80 [ACK] Seq=1335 Ack=52976 Win=16548 Len=0"
"193","26.788936","192.168.1.164","142.104.5.64","TCP","54","1201  >  80 [FIN, ACK] Seq=1335 Ack=52976 Win=16548 Len=0"
"194","26.790436","192.168.1.164","142.104.5.64","HTTP","490","GET /cosi HTTP/1.1 "
"195","26.791774","142.104.5.64","192.168.1.164","TCP","60","80  >  1201 [ACK] Seq=52976 Ack=1336 Win=17520 Len=0"
"196","26.797606","142.104.5.64","192.168.1.164","HTTP","520","HTTP/1.1 302 Found  (text/html)"
"197","26.854912","192.168.1.164","142.104.105.208","TCP","62","1202  >  80 [SYN] Seq=0 Win=16384 Len=0 MSS=1460 SACK_PERM"
"198","26.860757","142.104.105.208","192.168.1.164","TCP","62","80  >  1202 [SYN, ACK] Seq=0 Ack=1 Win=5840 Len=0 MSS=1460 SACK_PERM"
"199","26.860779","192.168.1.164","142.104.105.208","TCP","54","1202  >  80 [ACK] Seq=1 Ack=1 Win=17520 Len=0"
"200","26.860855","192.168.1.164","142.104.105.208","HTTP","490","GET / HTTP/1.1 "
"201","26.864799","142.104.105.208","192.168.1.164","TCP","60","80  >  1202 [ACK] Seq=1 Ack=437 Win=6432 Len=0"
"202","26.958297","192.168.1.164","142.104.5.64","TCP","54","1200  >  80 [ACK] Seq=3064 Ack=100546 Win=16827 Len=0"
"203","26.977591","142.104.105.208","192.168.1.164","TCP","1514","80  >  1202 [ACK] Seq=1 Ack=437 Win=6432 Len=1460 [TCP segment of a reassembled PDU]"
"204","26.979094","142.104.105.208","192.168.1.164","TCP","1514","80  >  1202 [ACK] Seq=1461 Ack=437 Win=6432 Len=1460 [TCP segment of a reassembled PDU]"
"205","26.979115","192.168.1.164","142.104.105.208","TCP","54","1202  >  80 [ACK] Seq=437 Ack=2921 Win=17520 Len=0"
"206","26.985575","142.104.105.208","192.168.1.164","TCP","1514","80  >  1202 [ACK] Seq=2921 Ack=437 Win=6432 Len=1460 [TCP segment of a reassembled PDU]"
"207","26.986954","142.104.105.208","192.168.1.164","TCP","1514","80  >  1202 [ACK] Seq=4381 Ack=437 Win=6432 Len=1460 [TCP segment of a reassembled PDU]"
"208","26.986968","192.168.1.164","142.104.105.208","TCP","54","1202  >  80 [ACK] Seq=437 Ack=5841 Win=17520 Len=0"
"209","26.988369","142.104.105.208","192.168.1.164","TCP","1514","80  >  1202 [ACK] Seq=5841 Ack=437 Win=6432 Len=1460 [TCP segment of a reassembled PDU]"
"210","26.992431","142.104.105.208","192.168.1.164","TCP","791","80  >  1202 [PSH, ACK] Seq=7301 Ack=437 Win=6432 Len=737 [TCP segment of a reassembled PDU]"
"211","26.992461","192.168.1.164","142.104.105.208","TCP","54","1202  >  80 [ACK] Seq=437 Ack=8038 Win=17520 Len=0"
"212","27.022668","142.104.105.208","192.168.1.164","TCP","1514","80  >  1202 [ACK] Seq=8038 Ack=437 Win=6432 Len=1460 [TCP segment of a reassembled PDU]"
"213","27.024162","142.104.105.208","192.168.1.164","TCP","1514","80  >  1202 [ACK] Seq=9498 Ack=437 Win=6432 Len=1460 [TCP segment of a reassembled PDU]"
"214","27.024180","192.168.1.164","142.104.105.208","TCP","54","1202  >  80 [ACK] Seq=437 Ack=10958 Win=17520 Len=0"
"215","27.024830","142.104.105.208","192.168.1.164","HTTP","521","HTTP/1.1 200 OK  (text/html)"
"216","27.138116","192.168.1.164","142.104.105.208","HTTP","413","GET /css/toplevel.css HTTP/1.1 "
"217","27.141287","142.104.105.208","192.168.1.164","TCP","60","80  >  1202 [ACK] Seq=11425 Ack=796 Win=7504 Len=0"
"218","27.144847","142.104.105.208","192.168.1.164","TCP","326","80  >  1202 [PSH, ACK] Seq=11425 Ack=796 Win=7504 Len=272 [TCP segment of a reassembled PDU]"
"219","27.144988","192.168.1.164","142.104.105.208","TCP","54","1202  >  80 [FIN, ACK] Seq=796 Ack=11697 Win=16781 Len=0"
"220","27.148109","142.104.105.208","192.168.1.164","TCP","1514","80  >  1202 [ACK] Seq=11697 Ack=796 Win=7504 Len=1460 [TCP segment of a reassembled PDU]"
"221","27.148138","192.168.1.164","142.104.105.208","TCP","54","1202  >  80 [RST, ACK] Seq=797 Ack=13157 Win=0 Len=0"
"222","27.149563","142.104.105.208","192.168.1.164","TCP","1514","80  >  1202 [ACK] Seq=13157 Ack=796 Win=7504 Len=1460 [TCP segment of a reassembled PDU]"
"223","27.150941","142.104.105.208","192.168.1.164","TCP","1514","80  >  1202 [ACK] Seq=14617 Ack=796 Win=7504 Len=1460 [TCP segment of a reassembled PDU]"
"224","27.154401","142.104.105.208","192.168.1.164","TCP","1514","80  >  1202 [ACK] Seq=16077 Ack=797 Win=7504 Len=1460 [TCP segment of a reassembled PDU]"
"225","27.154807","142.104.105.208","192.168.1.164","HTTP","267","HTTP/1.1 200 OK  (text/css)"
"226","27.155235","142.104.105.208","192.168.1.164","TCP","60","80  >  1202 [FIN, ACK] Seq=17750 Ack=797 Win=7504 Len=0"
"227","27.161723","192.168.1.164","142.104.105.208","TCP","62","1203  >  80 [SYN] Seq=0 Win=16384 Len=0 MSS=1460 SACK_PERM"
"228","27.164948","142.104.105.208","192.168.1.164","TCP","62","80  >  1203 [SYN, ACK] Seq=0 Ack=1 Win=5840 Len=0 MSS=1460 SACK_PERM"
"229","27.164968","192.168.1.164","142.104.105.208","TCP","54","1203  >  80 [ACK] Seq=1 Ack=1 Win=17520 Len=0"
"230","27.165036","192.168.1.164","142.104.105.208","HTTP","413","GET /css/red_theme.css HTTP/1.1 "
"231","27.168746","142.104.105.208","192.168.1.164","TCP","60","80  >  1203 [ACK] Seq=1 Ack=360 Win=6432 Len=0"
"232","27.172343","142.104.105.208","192.168.1.164","TCP","325","80  >  1203 [PSH, ACK] Seq=1 Ack=360 Win=6432 Len=271 [TCP segment of a reassembled PDU]"
"233","27.172424","192.168.1.164","142.104.105.208","TCP","54","1203  >  80 [FIN, ACK] Seq=360 Ack=272 Win=17249 Len=0"
"234","27.174183","142.104.105.208","192.168.1.164","HTTP","917","HTTP/1.1 200 OK  (text/css)"
"235","27.174226","192.168.1.164","142.104.105.208","TCP","54","1203  >  80 [RST, ACK] Seq=361 Ack=1135 Win=0 Len=0"
"236","27.174667","192.168.1.164","142.104.105.208","TCP","62","1204  >  80 [SYN] Seq=0 Win=16384 Len=0 MSS=1460 SACK_PERM"
"237","27.175729","142.104.105.208","192.168.1.164","TCP","60","80  >  1203 [FIN, ACK] Seq=1135 Ack=361 Win=6432 Len=0"
"238","27.177307","142.104.105.208","192.168.1.164","TCP","62","80  >  1204 [SYN, ACK] Seq=0 Ack=1 Win=5840 Len=0 MSS=1460 SACK_PERM"
"239","27.177326","192.168.1.164","142.104.105.208","TCP","54","1204  >  80 [ACK] Seq=1 Ack=1 Win=17520 Len=0"
"240","27.177393","192.168.1.164","142.104.105.208","HTTP","421","GET /images/uvic_4_csc_alt.gif HTTP/1.1 "
"241","27.180761","142.104.105.208","192.168.1.164","TCP","60","80  >  1204 [ACK] Seq=1 Ack=368 Win=6432 Len=0"
"242","27.184339","142.104.105.208","192.168.1.164","TCP","327","80  >  1204 [PSH, ACK] Seq=1 Ack=368 Win=6432 Len=273 [TCP segment of a reassembled PDU]"
"243","27.184421","192.168.1.164","142.104.105.208","TCP","54","1204  >  80 [FIN, ACK] Seq=368 Ack=274 Win=17247 Len=0"
"244","27.187590","142.104.105.208","192.168.1.164","TCP","1514","80  >  1204 [ACK] Seq=274 Ack=368 Win=6432 Len=1460 [TCP segment of a reassembled PDU]"
"245","27.187612","192.168.1.164","142.104.105.208","TCP","54","1204  >  80 [RST, ACK] Seq=369 Ack=1734 Win=0 Len=0"
"246","27.188311","142.104.105.208","192.168.1.164","HTTP","616","HTTP/1.1 200 OK  (GIF89a)"
"247","27.188983","142.104.105.208","192.168.1.164","TCP","60","80  >  1204 [FIN, ACK] Seq=2296 Ack=369 Win=6432 Len=0"
"248","27.210152","192.168.1.164","142.104.105.208","TCP","62","1205  >  80 [SYN] Seq=0 Win=16384 Len=0 MSS=1460 SACK_PERM"
"249","27.212861","142.104.105.208","192.168.1.164","TCP","62","80  >  1205 [SYN, ACK] Seq=0 Ack=1 Win=5840 Len=0 MSS=1460 SACK_PERM"
"250","27.212886","192.168.1.164","142.104.105.208","TCP","54","1205  >  80 [ACK] Seq=1 Ack=1 Win=17520 Len=0"
"251","27.212967","192.168.1.164","142.104.105.208","HTTP","420","GET /images/banner01_alt.jpg HTTP/1.1 "
"252","27.216263","142.104.105.208","192.168.1.164","TCP","60","80  >  1205 [ACK] Seq=1 Ack=367 Win=6432 Len=0"
"253","27.220350","142.104.105.208","192.168.1.164","TCP","329","80  >  1205 [PSH, ACK] Seq=1 Ack=367 Win=6432 Len=275 [TCP segment of a reassembled PDU]"
"254","27.220436","192.168.1.164","142.104.105.208","TCP","54","1205  >  80 [FIN, ACK] Seq=367 Ack=276 Win=17245 Len=0"
"255","27.228081","142.104.105.208","192.168.1.164","TCP","1514","80  >  1205 [ACK] Seq=276 Ack=367 Win=6432 Len=1460 [TCP segment of a reassembled PDU]"
"256","27.228109","192.168.1.164","142.104.105.208","TCP","54","1205  >  80 [RST, ACK] Seq=368 Ack=1736 Win=0 Len=0"
"257","27.229455","142.104.105.208","192.168.1.164","TCP","1514","80  >  1205 [ACK] Seq=1736 Ack=368 Win=6432 Len=1460 [TCP segment of a reassembled PDU]"
"258","27.230399","192.168.1.164","142.104.105.208","TCP","62","1206  >  80 [SYN] Seq=0 Win=16384 Len=0 MSS=1460 SACK_PERM"
"259","27.230774","192.168.1.164","142.104.105.208","TCP","62","1207  >  80 [SYN] Seq=0 Win=16384 Len=0 MSS=1460 SACK_PERM"
"260","27.233232","142.104.105.208","192.168.1.164","TCP","1514","80  >  1205 [ACK] Seq=3196 Ack=368 Win=6432 Len=1460 [TCP segment of a reassembled PDU]"
"261","27.236691","142.104.105.208","192.168.1.164","TCP","62","80  >  1206 [SYN, ACK] Seq=0 Ack=1 Win=5840 Len=0 MSS=1460 SACK_PERM"
"262","27.236752","192.168.1.164","142.104.105.208","TCP","54","1206  >  80 [ACK] Seq=1 Ack=1 Win=17520 Len=0"
"263","27.236879","192.168.1.164","142.104.105.208","HTTP","419","GET /images/dept_csc_alt.gif HTTP/1.1 "
"264","27.237054","142.104.105.208","192.168.1.164","TCP","62","80  >  1207 [SYN, ACK] Seq=0 Ack=1 Win=5840 Len=0 MSS=1460 SACK_PERM"
"265","27.237073","192.168.1.164","142.104.105.208","TCP","54","1207  >  80 [ACK] Seq=1 Ack=1 Win=17520 Len=0"
"266","27.237134","192.168.1.164","142.104.105.208","HTTP","332","GET /assets/images/span.gif HTTP/1.1 "
"267","27.240333","142.104.105.208","192.168.1.164","TCP","60","80  >  1206 [ACK] Seq=1 Ack=366 Win=6432 Len=0"
"268","27.241372","142.104.105.208","192.168.1.164","TCP","60","80  >  1207 [ACK] Seq=1 Ack=279 Win=6432 Len=0"
"269","27.245793","142.104.105.208","192.168.1.164","TCP","327","80  >  1206 [PSH, ACK] Seq=1 Ack=366 Win=6432 Len=273 [TCP segment of a reassembled PDU]"
"270","27.245975","192.168.1.164","142.104.105.208","TCP","54","1206  >  80 [FIN, ACK] Seq=366 Ack=274 Win=17247 Len=0"
"271","27.248725","142.104.105.208","192.168.1.164","TCP","1514","80  >  1206 [ACK] Seq=274 Ack=366 Win=6432 Len=1460 [TCP segment of a reassembled PDU]"
"272","27.248762","192.168.1.164","142.104.105.208","TCP","54","1206  >  80 [RST, ACK] Seq=367 Ack=1734 Win=0 Len=0"
"273","27.249090","142.104.105.208","192.168.1.164","HTTP","147","HTTP/1.1 200 OK  (GIF89a)"
"274","27.250907","142.104.105.208","192.168.1.164","TCP","60","80  >  1206 [FIN, ACK] Seq=1827 Ack=367 Win=6432 Len=0"
"275","27.279984","192.168.1.164","142.104.105.208","TCP","62","1208  >  80 [SYN] Seq=0 Win=16384 Len=0 MSS=1460 SACK_PERM"
"276","27.284752","142.104.105.208","192.168.1.164","TCP","1514","80  >  1207 [ACK] Seq=1 Ack=279 Win=6432 Len=1460 [TCP segment of a reassembled PDU]"
"277","27.285002","192.168.1.164","142.104.105.208","TCP","54","1207  >  80 [RST, ACK] Seq=279 Ack=1461 Win=0 Len=0"
"278","27.286248","142.104.105.208","192.168.1.164","TCP","1514","HTTP/1.1 404 Not Found  [TCP segment of a reassembled PDU]"
"279","27.287929","142.104.105.208","192.168.1.164","TCP","62","80  >  1208 [SYN, ACK] Seq=0 Ack=1 Win=5840 Len=0 MSS=1460 SACK_PERM"
"280","27.287957","192.168.1.164","142.104.105.208","TCP","54","1208  >  80 [ACK] Seq=1 Ack=1 Win=17520 Len=0"
"281","27.288044","192.168.1.164","142.104.105.208","HTTP","429","GET /news_photos/2004_07_15_hinf.jpg HTTP/1.1 "
"282","27.291828","142.104.105.208","192.168.1.164","TCP","60","80  >  1208 [ACK] Seq=1 Ack=376 Win=6432 Len=0"
"283","27.297927","142.104.105.208","192.168.1.164","TCP","330","80  >  1208 [PSH, ACK] Seq=1 Ack=376 Win=6432 Len=276 [TCP segment of a reassembled PDU]"
"284","27.298287","192.168.1.164","142.104.105.208","TCP","54","1208  >  80 [FIN, ACK] Seq=376 Ack=277 Win=17244 Len=0"
"285","27.301173","142.104.105.208","192.168.1.164","TCP","1514","80  >  1208 [ACK] Seq=277 Ack=376 Win=6432 Len=1460 [TCP segment of a reassembled PDU]"
"286","27.301221","192.168.1.164","142.104.105.208","TCP","54","1208  >  80 [RST, ACK] Seq=377 Ack=1737 Win=0 Len=0"
"287","27.304634","142.104.105.208","192.168.1.164","TCP","1514","80  >  1208 [ACK] Seq=1737 Ack=377 Win=6432 Len=1460 [TCP segment of a reassembled PDU]"
"288","27.306088","142.104.105.208","192.168.1.164","TCP","1514","80  >  1208 [ACK] Seq=3197 Ack=377 Win=6432 Len=1460 [TCP segment of a reassembled PDU]"
"289","30.025742","192.168.1.164","142.104.105.208","TCP","62","1209  >  80 [SYN] Seq=0 Win=16384 Len=0 MSS=1460 SACK_PERM"
"290","30.028751","142.104.105.208","192.168.1.164","TCP","62","80  >  1209 [SYN, ACK] Seq=0 Ack=1 Win=5840 Len=0 MSS=1460 SACK_PERM"
"291","30.028791","192.168.1.164","142.104.105.208","TCP","54","1209  >  80 [ACK] Seq=1 Ack=1 Win=17520 Len=0"
"292","30.028896","192.168.1.164","142.104.105.208","HTTP","492","GET /contacts/general.html HTTP/1.1 "
"293","30.033144","142.104.105.208","192.168.1.164","TCP","60","80  >  1209 [ACK] Seq=1 Ack=439 Win=6432 Len=0"
"294","30.041777","142.104.105.208","192.168.1.164","TCP","348","80  >  1209 [PSH, ACK] Seq=1 Ack=439 Win=6432 Len=294 [TCP segment of a reassembled PDU]"
"295","30.044948","142.104.105.208","192.168.1.164","TCP","1514","80  >  1209 [ACK] Seq=295 Ack=439 Win=6432 Len=1460 [TCP segment of a reassembled PDU]"
"296","30.044968","192.168.1.164","142.104.105.208","TCP","54","1209  >  80 [ACK] Seq=439 Ack=1755 Win=17520 Len=0"
"297","30.050966","142.104.105.208","192.168.1.164","TCP","1514","80  >  1209 [ACK] Seq=1755 Ack=439 Win=6432 Len=1460 [TCP segment of a reassembled PDU]"
"298","30.052467","142.104.105.208","192.168.1.164","TCP","1514","80  >  1209 [ACK] Seq=3215 Ack=439 Win=6432 Len=1460 [TCP segment of a reassembled PDU]"
"299","30.052482","192.168.1.164","142.104.105.208","TCP","54","1209  >  80 [ACK] Seq=439 Ack=4675 Win=17520 Len=0"
"300","30.053601","142.104.105.208","192.168.1.164","HTTP","1139","HTTP/1.1 200 OK  (text/html)"
"301","30.162551","192.168.1.164","142.104.105.208","TCP","54","1209  >  80 [ACK] Seq=439 Ack=5760 Win=16435 Len=0"
"302","30.190078","192.168.1.164","142.104.105.208","HTTP","436","GET /css/blue_theme.css HTTP/1.1 "
"303","30.190784","192.168.1.164","142.104.105.208","TCP","62","1210  >  80 [SYN] Seq=0 Win=16384 Len=0 MSS=1460 SACK_PERM"
"304","30.193815","142.104.105.208","192.168.1.164","TCP","62","80  >  1210 [SYN, ACK] Seq=0 Ack=1 Win=5840 Len=0 MSS=1460 SACK_PERM"
"305","30.193863","192.168.1.164","142.104.105.208","TCP","54","1210  >  80 [ACK] Seq=1 Ack=1 Win=17520 Len=0"
"306","30.193974","192.168.1.164","142.104.105.208","HTTP","353","GET /assets/images/span.gif HTTP/1.1 "
