No.     Time           Source                Destination           Protocol Length Info
      1 0.000000       192.168.1.164         142.104.5.64          TCP      62     1200 → 80 [SYN] Seq=0 Win=16384 Len=0 MSS=1460 SACK_PERM

Frame 1: 62 bytes on wire (496 bits), 62 bytes captured (496 bits)
Ethernet II, Src: Intel_a1:48:60 (00:0e:35:a1:48:60), Dst: 3comFast_20:98:c5 (00:10:5a:20:98:c5)
Internet Protocol Version 4, Src: 192.168.1.164, Dst: 142.104.5.64
Transmission Control Protocol, Src Port: 1200, Dst Port: 80, Seq: 0, Len: 0
    Source Port: 1200
    Destination Port: 80
    [Stream index: 0]
    [Conversation completeness: Complete, WITH_DATA (63)]
    [TCP Segment Len: 0]
    Sequence Number: 0    (relative sequence number)
    Sequence Number (raw): 2187554249
    [Next Sequence Number: 1    (relative sequence number)]
    Acknowledgment Number: 0
    Acknowledgment number (raw): 0
    0111 .... = Header Length: 28 bytes (7)
    Flags: 0x002 (SYN)
    Window: 16384
    [Calculated window size: 16384]
    Checksum: 0xf7fd [unverified]
    [Checksum Status: Unverified]
    Urgent Pointer: 0
    Options: (8 bytes), Maximum segment size, No-Operation (NOP), No-Operation (NOP), SACK permitted
    [Timestamps]

No.     Time           Source                Destination           Protocol Length Info
      2 0.002812       142.104.5.64          192.168.1.164         TCP      60     80 → 1200 [SYN, ACK] Seq=0 Ack=1 Win=17520 Len=0 MSS=1460

Frame 2: 60 bytes on wire (480 bits), 60 bytes captured (480 bits)
Ethernet II, Src: 3comFast_20:98:c5 (00:10:5a:20:98:c5), Dst: Intel_a1:48:60 (00:0e:35:a1:48:60)
Internet Protocol Version 4, Src: 142.104.5.64, Dst: 192.168.1.164
Transmission Control Protocol, Src Port: 80, Dst Port: 1200, Seq: 0, Ack: 1, Len: 0
    Source Port: 80
    Destination Port: 1200
    [Stream index: 0]
    [Conversation completeness: Complete, WITH_DATA (63)]
    [TCP Segment Len: 0]
    Sequence Number: 0    (relative sequence number)
    Sequence Number (raw): 625910336
    [Next Sequence Number: 1    (relative sequence number)]
    Acknowledgment Number: 1    (relative ack number)
    Acknowledgment number (raw): 2187554250
    0110 .... = Header Length: 24 bytes (6)
    Flags: 0x012 (SYN, ACK)
    Window: 17520
    [Calculated window size: 17520]
    Checksum: 0x40f5 [unverified]
    [Checksum Status: Unverified]
    Urgent Pointer: 0
    Options: (4 bytes), Maximum segment size
    [Timestamps]
    [SEQ/ACK analysis]

No.     Time           Source                Destination           Protocol Length Info
      3 0.002835       192.168.1.164         142.104.5.64          TCP      54     1200 → 80 [ACK] Seq=1 Ack=1 Win=17520 Len=0

Frame 3: 54 bytes on wire (432 bits), 54 bytes captured (432 bits)
Ethernet II, Src: Intel_a1:48:60 (00:0e:35:a1:48:60), Dst: 3comFast_20:98:c5 (00:10:5a:20:98:c5)
Internet Protocol Version 4, Src: 192.168.1.164, Dst: 142.104.5.64
Transmission Control Protocol, Src Port: 1200, Dst Port: 80, Seq: 1, Ack: 1, Len: 0
    Source Port: 1200
    Destination Port: 80
    [Stream index: 0]
    [Conversation completeness: Complete, WITH_DATA (63)]
    [TCP Segment Len: 0]
    Sequence Number: 1    (relative sequence number)
    Sequence Number (raw): 2187554250
    [Next Sequence Number: 1    (relative sequence number)]
    Acknowledgment Number: 1    (relative ack number)
    Acknowledgment number (raw): 625910337
    0101 .... = Header Length: 20 bytes (5)
    Flags: 0x010 (ACK)
    Window: 17520
    [Calculated window size: 17520]
    [Window size scaling factor: -2 (no window scaling used)]
    Checksum: 0x58b2 [unverified]
    [Checksum Status: Unverified]
    Urgent Pointer: 0
    [Timestamps]
    [SEQ/ACK analysis]

No.     Time           Source                Destination           Protocol Length Info
      4 0.002916       192.168.1.164         142.104.5.64          HTTP     473    GET /index.html HTTP/1.1 

Frame 4: 473 bytes on wire (3784 bits), 473 bytes captured (3784 bits)
Ethernet II, Src: Intel_a1:48:60 (00:0e:35:a1:48:60), Dst: 3comFast_20:98:c5 (00:10:5a:20:98:c5)
Internet Protocol Version 4, Src: 192.168.1.164, Dst: 142.104.5.64
Transmission Control Protocol, Src Port: 1200, Dst Port: 80, Seq: 1, Ack: 1, Len: 419
    Source Port: 1200
    Destination Port: 80
    [Stream index: 0]
    [Conversation completeness: Complete, WITH_DATA (63)]
    [TCP Segment Len: 419]
    Sequence Number: 1    (relative sequence number)
    Sequence Number (raw): 2187554250
    [Next Sequence Number: 420    (relative sequence number)]
    Acknowledgment Number: 1    (relative ack number)
    Acknowledgment number (raw): 625910337
    0101 .... = Header Length: 20 bytes (5)
    Flags: 0x018 (PSH, ACK)
    Window: 17520
    [Calculated window size: 17520]
    [Window size scaling factor: -2 (no window scaling used)]
    Checksum: 0x5459 [unverified]
    [Checksum Status: Unverified]
    Urgent Pointer: 0
    [Timestamps]
    [SEQ/ACK analysis]
    TCP payload (419 bytes)
Hypertext Transfer Protocol

No.     Time           Source                Destination           Protocol Length Info
      5 0.015346       142.104.5.64          192.168.1.164         TCP      1514   80 → 1200 [ACK] Seq=1 Ack=420 Win=17520 Len=1460 [TCP segment of a reassembled PDU]

Frame 5: 1514 bytes on wire (12112 bits), 1514 bytes captured (12112 bits)
Ethernet II, Src: 3comFast_20:98:c5 (00:10:5a:20:98:c5), Dst: Intel_a1:48:60 (00:0e:35:a1:48:60)
Internet Protocol Version 4, Src: 142.104.5.64, Dst: 192.168.1.164
Transmission Control Protocol, Src Port: 80, Dst Port: 1200, Seq: 1, Ack: 420, Len: 1460
    Source Port: 80
    Destination Port: 1200
    [Stream index: 0]
    [Conversation completeness: Complete, WITH_DATA (63)]
    [TCP Segment Len: 1460]
    Sequence Number: 1    (relative sequence number)
    Sequence Number (raw): 625910337
    [Next Sequence Number: 1461    (relative sequence number)]
    Acknowledgment Number: 420    (relative ack number)
    Acknowledgment number (raw): 2187554669
    0101 .... = Header Length: 20 bytes (5)
    Flags: 0x010 (ACK)
    Window: 17520
    [Calculated window size: 17520]
    [Window size scaling factor: -2 (no window scaling used)]
    Checksum: 0xe8e2 [unverified]
    [Checksum Status: Unverified]
    Urgent Pointer: 0
    [Timestamps]
    [SEQ/ACK analysis]
    TCP payload (1460 bytes)
    [Reassembled PDU in frame: 20]
    TCP segment data (1460 bytes)

No.     Time           Source                Destination           Protocol Length Info
      6 0.016755       142.104.5.64          192.168.1.164         TCP      1514   80 → 1200 [ACK] Seq=1461 Ack=420 Win=17520 Len=1460 [TCP segment of a reassembled PDU]

Frame 6: 1514 bytes on wire (12112 bits), 1514 bytes captured (12112 bits)
Ethernet II, Src: 3comFast_20:98:c5 (00:10:5a:20:98:c5), Dst: Intel_a1:48:60 (00:0e:35:a1:48:60)
Internet Protocol Version 4, Src: 142.104.5.64, Dst: 192.168.1.164
Transmission Control Protocol, Src Port: 80, Dst Port: 1200, Seq: 1461, Ack: 420, Len: 1460
    Source Port: 80
    Destination Port: 1200
    [Stream index: 0]
    [Conversation completeness: Complete, WITH_DATA (63)]
    [TCP Segment Len: 1460]
    Sequence Number: 1461    (relative sequence number)
    Sequence Number (raw): 625911797
    [Next Sequence Number: 2921    (relative sequence number)]
    Acknowledgment Number: 420    (relative ack number)
    Acknowledgment number (raw): 2187554669
    0101 .... = Header Length: 20 bytes (5)
    Flags: 0x010 (ACK)
    Window: 17520
    [Calculated window size: 17520]
    [Window size scaling factor: -2 (no window scaling used)]
    Checksum: 0x7307 [unverified]
    [Checksum Status: Unverified]
    Urgent Pointer: 0
    [Timestamps]
    [SEQ/ACK analysis]
    TCP payload (1460 bytes)
    [Reassembled PDU in frame: 20]
    TCP segment data (1460 bytes)

No.     Time           Source                Destination           Protocol Length Info
      7 0.016776       192.168.1.164         142.104.5.64          TCP      54     1200 → 80 [ACK] Seq=420 Ack=2921 Win=17520 Len=0

Frame 7: 54 bytes on wire (432 bits), 54 bytes captured (432 bits)
Ethernet II, Src: Intel_a1:48:60 (00:0e:35:a1:48:60), Dst: 3comFast_20:98:c5 (00:10:5a:20:98:c5)
Internet Protocol Version 4, Src: 192.168.1.164, Dst: 142.104.5.64
Transmission Control Protocol, Src Port: 1200, Dst Port: 80, Seq: 420, Ack: 2921, Len: 0
    Source Port: 1200
    Destination Port: 80
    [Stream index: 0]
    [Conversation completeness: Complete, WITH_DATA (63)]
    [TCP Segment Len: 0]
    Sequence Number: 420    (relative sequence number)
    Sequence Number (raw): 2187554669
    [Next Sequence Number: 420    (relative sequence number)]
    Acknowledgment Number: 2921    (relative ack number)
    Acknowledgment number (raw): 625913257
    0101 .... = Header Length: 20 bytes (5)
    Flags: 0x010 (ACK)
    Window: 17520
    [Calculated window size: 17520]
    [Window size scaling factor: -2 (no window scaling used)]
    Checksum: 0x4ba7 [unverified]
    [Checksum Status: Unverified]
    Urgent Pointer: 0
    [Timestamps]
    [SEQ/ACK analysis]

No.     Time           Source                Destination           Protocol Length Info
      8 0.018250       142.104.5.64          192.168.1.164         TCP      1514   80 → 1200 [ACK] Seq=2921 Ack=420 Win=17520 Len=1460 [TCP segment of a reassembled PDU]

Frame 8: 1514 bytes on wire (12112 bits), 1514 bytes captured (12112 bits)
Ethernet II, Src: 3comFast_20:98:c5 (00:10:5a:20:98:c5), Dst: Intel_a1:48:60 (00:0e:35:a1:48:60)
Internet Protocol Version 4, Src: 142.104.5.64, Dst: 192.168.1.164
Transmission Control Protocol, Src Port: 80, Dst Port: 1200, Seq: 2921, Ack: 420, Len: 1460
    Source Port: 80
    Destination Port: 1200
    [Stream index: 0]
    [Conversation completeness: Complete, WITH_DATA (63)]
    [TCP Segment Len: 1460]
    Sequence Number: 2921    (relative sequence number)
    Sequence Number (raw): 625913257
    [Next Sequence Number: 4381    (relative sequence number)]
    Acknowledgment Number: 420    (relative ack number)
    Acknowledgment number (raw): 2187554669
    0101 .... = Header Length: 20 bytes (5)
    Flags: 0x010 (ACK)
    Window: 17520
    [Calculated window size: 17520]
    [Window size scaling factor: -2 (no window scaling used)]
    Checksum: 0xe0f2 [unverified]
    [Checksum Status: Unverified]
    Urgent Pointer: 0
    [Timestamps]
    [SEQ/ACK analysis]
    TCP payload (1460 bytes)
    [Reassembled PDU in frame: 20]
    TCP segment data (1460 bytes)

No.     Time           Source                Destination           Protocol Length Info
      9 0.025730       142.104.5.64          192.168.1.164         TCP      1514   80 → 1200 [ACK] Seq=4381 Ack=420 Win=17520 Len=1460 [TCP segment of a reassembled PDU]

Frame 9: 1514 bytes on wire (12112 bits), 1514 bytes captured (12112 bits)
Ethernet II, Src: 3comFast_20:98:c5 (00:10:5a:20:98:c5), Dst: Intel_a1:48:60 (00:0e:35:a1:48:60)
Internet Protocol Version 4, Src: 142.104.5.64, Dst: 192.168.1.164
Transmission Control Protocol, Src Port: 80, Dst Port: 1200, Seq: 4381, Ack: 420, Len: 1460
    Source Port: 80
    Destination Port: 1200
    [Stream index: 0]
    [Conversation completeness: Complete, WITH_DATA (63)]
    [TCP Segment Len: 1460]
    Sequence Number: 4381    (relative sequence number)
    Sequence Number (raw): 625914717
    [Next Sequence Number: 5841    (relative sequence number)]
    Acknowledgment Number: 420    (relative ack number)
    Acknowledgment number (raw): 2187554669
    0101 .... = Header Length: 20 bytes (5)
    Flags: 0x010 (ACK)
    Window: 17520
    [Calculated window size: 17520]
    [Window size scaling factor: -2 (no window scaling used)]
    Checksum: 0x9d02 [unverified]
    [Checksum Status: Unverified]
    Urgent Pointer: 0
    [Timestamps]
    [SEQ/ACK analysis]
    TCP payload (1460 bytes)
    [Reassembled PDU in frame: 20]
    TCP segment data (1460 bytes)

No.     Time           Source                Destination           Protocol Length Info
     10 0.025753       192.168.1.164         142.104.5.64          TCP      54     1200 → 80 [ACK] Seq=420 Ack=5841 Win=17520 Len=0

Frame 10: 54 bytes on wire (432 bits), 54 bytes captured (432 bits)
Ethernet II, Src: Intel_a1:48:60 (00:0e:35:a1:48:60), Dst: 3comFast_20:98:c5 (00:10:5a:20:98:c5)
Internet Protocol Version 4, Src: 192.168.1.164, Dst: 142.104.5.64
Transmission Control Protocol, Src Port: 1200, Dst Port: 80, Seq: 420, Ack: 5841, Len: 0
    Source Port: 1200
    Destination Port: 80
    [Stream index: 0]
    [Conversation completeness: Complete, WITH_DATA (63)]
    [TCP Segment Len: 0]
    Sequence Number: 420    (relative sequence number)
    Sequence Number (raw): 2187554669
    [Next Sequence Number: 420    (relative sequence number)]
    Acknowledgment Number: 5841    (relative ack number)
    Acknowledgment number (raw): 625916177
    0101 .... = Header Length: 20 bytes (5)
    Flags: 0x010 (ACK)
    Window: 17520
    [Calculated window size: 17520]
    [Window size scaling factor: -2 (no window scaling used)]
    Checksum: 0x403f [unverified]
    [Checksum Status: Unverified]
    Urgent Pointer: 0
    [Timestamps]
    [SEQ/ACK analysis]

No.     Time           Source                Destination           Protocol Length Info
     11 0.027093       142.104.5.64          192.168.1.164         TCP      1514   80 → 1200 [ACK] Seq=5841 Ack=420 Win=17520 Len=1460 [TCP segment of a reassembled PDU]

Frame 11: 1514 bytes on wire (12112 bits), 1514 bytes captured (12112 bits)
Ethernet II, Src: 3comFast_20:98:c5 (00:10:5a:20:98:c5), Dst: Intel_a1:48:60 (00:0e:35:a1:48:60)
Internet Protocol Version 4, Src: 142.104.5.64, Dst: 192.168.1.164
Transmission Control Protocol, Src Port: 80, Dst Port: 1200, Seq: 5841, Ack: 420, Len: 1460
    Source Port: 80
    Destination Port: 1200
    [Stream index: 0]
    [Conversation completeness: Complete, WITH_DATA (63)]
    [TCP Segment Len: 1460]
    Sequence Number: 5841    (relative sequence number)
    Sequence Number (raw): 625916177
    [Next Sequence Number: 7301    (relative sequence number)]
    Acknowledgment Number: 420    (relative ack number)
    Acknowledgment number (raw): 2187554669
    0101 .... = Header Length: 20 bytes (5)
    Flags: 0x010 (ACK)
    Window: 17520
    [Calculated window size: 17520]
    [Window size scaling factor: -2 (no window scaling used)]
    Checksum: 0x446b [unverified]
    [Checksum Status: Unverified]
    Urgent Pointer: 0
    [Timestamps]
    [SEQ/ACK analysis]
    TCP payload (1460 bytes)
    [Reassembled PDU in frame: 20]
    TCP segment data (1460 bytes)

No.     Time           Source                Destination           Protocol Length Info
     12 0.030109       142.104.5.64          192.168.1.164         TCP      1514   80 → 1200 [ACK] Seq=7301 Ack=420 Win=17520 Len=1460 [TCP segment of a reassembled PDU]

Frame 12: 1514 bytes on wire (12112 bits), 1514 bytes captured (12112 bits)
Ethernet II, Src: 3comFast_20:98:c5 (00:10:5a:20:98:c5), Dst: Intel_a1:48:60 (00:0e:35:a1:48:60)
Internet Protocol Version 4, Src: 142.104.5.64, Dst: 192.168.1.164
Transmission Control Protocol, Src Port: 80, Dst Port: 1200, Seq: 7301, Ack: 420, Len: 1460
    Source Port: 80
    Destination Port: 1200
    [Stream index: 0]
    [Conversation completeness: Complete, WITH_DATA (63)]
    [TCP Segment Len: 1460]
    Sequence Number: 7301    (relative sequence number)
    Sequence Number (raw): 625917637
    [Next Sequence Number: 8761    (relative sequence number)]
    Acknowledgment Number: 420    (relative ack number)
    Acknowledgment number (raw): 2187554669
    0101 .... = Header Length: 20 bytes (5)
    Flags: 0x010 (ACK)
    Window: 17520
    [Calculated window size: 17520]
    [Window size scaling factor: -2 (no window scaling used)]
    Checksum: 0x2528 [unverified]
    [Checksum Status: Unverified]
    Urgent Pointer: 0
    [Timestamps]
    [SEQ/ACK analysis]
    TCP payload (1460 bytes)
    [Reassembled PDU in frame: 20]
    TCP segment data (1460 bytes)

No.     Time           Source                Destination           Protocol Length Info
     13 0.030129       192.168.1.164         142.104.5.64          TCP      54     1200 → 80 [ACK] Seq=420 Ack=8761 Win=17520 Len=0

Frame 13: 54 bytes on wire (432 bits), 54 bytes captured (432 bits)
Ethernet II, Src: Intel_a1:48:60 (00:0e:35:a1:48:60), Dst: 3comFast_20:98:c5 (00:10:5a:20:98:c5)
Internet Protocol Version 4, Src: 192.168.1.164, Dst: 142.104.5.64
Transmission Control Protocol, Src Port: 1200, Dst Port: 80, Seq: 420, Ack: 8761, Len: 0
    Source Port: 1200
    Destination Port: 80
    [Stream index: 0]
    [Conversation completeness: Complete, WITH_DATA (63)]
    [TCP Segment Len: 0]
    Sequence Number: 420    (relative sequence number)
    Sequence Number (raw): 2187554669
    [Next Sequence Number: 420    (relative sequence number)]
    Acknowledgment Number: 8761    (relative ack number)
    Acknowledgment number (raw): 625919097
    0101 .... = Header Length: 20 bytes (5)
    Flags: 0x010 (ACK)
    Window: 17520
    [Calculated window size: 17520]
    [Window size scaling factor: -2 (no window scaling used)]
    Checksum: 0x34d7 [unverified]
    [Checksum Status: Unverified]
    Urgent Pointer: 0
    [Timestamps]
    [SEQ/ACK analysis]

No.     Time           Source                Destination           Protocol Length Info
     14 0.034411       142.104.5.64          192.168.1.164         TCP      1514   80 → 1200 [ACK] Seq=8761 Ack=420 Win=17520 Len=1460 [TCP segment of a reassembled PDU]

Frame 14: 1514 bytes on wire (12112 bits), 1514 bytes captured (12112 bits)
Ethernet II, Src: 3comFast_20:98:c5 (00:10:5a:20:98:c5), Dst: Intel_a1:48:60 (00:0e:35:a1:48:60)
Internet Protocol Version 4, Src: 142.104.5.64, Dst: 192.168.1.164
Transmission Control Protocol, Src Port: 80, Dst Port: 1200, Seq: 8761, Ack: 420, Len: 1460
    Source Port: 80
    Destination Port: 1200
    [Stream index: 0]
    [Conversation completeness: Complete, WITH_DATA (63)]
    [TCP Segment Len: 1460]
    Sequence Number: 8761    (relative sequence number)
    Sequence Number (raw): 625919097
    [Next Sequence Number: 10221    (relative sequence number)]
    Acknowledgment Number: 420    (relative ack number)
    Acknowledgment number (raw): 2187554669
    0101 .... = Header Length: 20 bytes (5)
    Flags: 0x010 (ACK)
    Window: 17520
    [Calculated window size: 17520]
    [Window size scaling factor: -2 (no window scaling used)]
    Checksum: 0x1f0a [unverified]
    [Checksum Status: Unverified]
    Urgent Pointer: 0
    [Timestamps]
    [SEQ/ACK analysis]
    TCP payload (1460 bytes)
    [Reassembled PDU in frame: 20]
    TCP segment data (1460 bytes)

No.     Time           Source                Destination           Protocol Length Info
     15 0.034432       192.168.1.164         142.104.5.64          TCP      54     1200 → 80 [ACK] Seq=420 Ack=10221 Win=16060 Len=0

Frame 15: 54 bytes on wire (432 bits), 54 bytes captured (432 bits)
Ethernet II, Src: Intel_a1:48:60 (00:0e:35:a1:48:60), Dst: 3comFast_20:98:c5 (00:10:5a:20:98:c5)
Internet Protocol Version 4, Src: 192.168.1.164, Dst: 142.104.5.64
Transmission Control Protocol, Src Port: 1200, Dst Port: 80, Seq: 420, Ack: 10221, Len: 0
    Source Port: 1200
    Destination Port: 80
    [Stream index: 0]
    [Conversation completeness: Complete, WITH_DATA (63)]
    [TCP Segment Len: 0]
    Sequence Number: 420    (relative sequence number)
    Sequence Number (raw): 2187554669
    [Next Sequence Number: 420    (relative sequence number)]
    Acknowledgment Number: 10221    (relative ack number)
    Acknowledgment number (raw): 625920557
    0101 .... = Header Length: 20 bytes (5)
    Flags: 0x010 (ACK)
    Window: 16060
    [Calculated window size: 16060]
    [Window size scaling factor: -2 (no window scaling used)]
    Checksum: 0x34d7 [unverified]
    [Checksum Status: Unverified]
    Urgent Pointer: 0
    [Timestamps]
    [SEQ/ACK analysis]

No.     Time           Source                Destination           Protocol Length Info
     16 0.035788       142.104.5.64          192.168.1.164         TCP      1514   80 → 1200 [ACK] Seq=10221 Ack=420 Win=17520 Len=1460 [TCP segment of a reassembled PDU]

Frame 16: 1514 bytes on wire (12112 bits), 1514 bytes captured (12112 bits)
Ethernet II, Src: 3comFast_20:98:c5 (00:10:5a:20:98:c5), Dst: Intel_a1:48:60 (00:0e:35:a1:48:60)
Internet Protocol Version 4, Src: 142.104.5.64, Dst: 192.168.1.164
Transmission Control Protocol, Src Port: 80, Dst Port: 1200, Seq: 10221, Ack: 420, Len: 1460
    Source Port: 80
    Destination Port: 1200
    [Stream index: 0]
    [Conversation completeness: Complete, WITH_DATA (63)]
    [TCP Segment Len: 1460]
    Sequence Number: 10221    (relative sequence number)
    Sequence Number (raw): 625920557
    [Next Sequence Number: 11681    (relative sequence number)]
    Acknowledgment Number: 420    (relative ack number)
    Acknowledgment number (raw): 2187554669
    0101 .... = Header Length: 20 bytes (5)
    Flags: 0x010 (ACK)
    Window: 17520
    [Calculated window size: 17520]
    [Window size scaling factor: -2 (no window scaling used)]
    Checksum: 0x719b [unverified]
    [Checksum Status: Unverified]
    Urgent Pointer: 0
    [Timestamps]
    [SEQ/ACK analysis]
    TCP payload (1460 bytes)
    [Reassembled PDU in frame: 20]
    TCP segment data (1460 bytes)

No.     Time           Source                Destination           Protocol Length Info
     17 0.037570       142.104.5.64          192.168.1.164         TCP      1514   80 → 1200 [ACK] Seq=11681 Ack=420 Win=17520 Len=1460 [TCP segment of a reassembled PDU]

Frame 17: 1514 bytes on wire (12112 bits), 1514 bytes captured (12112 bits)
Ethernet II, Src: 3comFast_20:98:c5 (00:10:5a:20:98:c5), Dst: Intel_a1:48:60 (00:0e:35:a1:48:60)
Internet Protocol Version 4, Src: 142.104.5.64, Dst: 192.168.1.164
Transmission Control Protocol, Src Port: 80, Dst Port: 1200, Seq: 11681, Ack: 420, Len: 1460
    Source Port: 80
    Destination Port: 1200
    [Stream index: 0]
    [Conversation completeness: Complete, WITH_DATA (63)]
    [TCP Segment Len: 1460]
    Sequence Number: 11681    (relative sequence number)
    Sequence Number (raw): 625922017
    [Next Sequence Number: 13141    (relative sequence number)]
    Acknowledgment Number: 420    (relative ack number)
    Acknowledgment number (raw): 2187554669
    0101 .... = Header Length: 20 bytes (5)
    Flags: 0x010 (ACK)
    Window: 17520
    [Calculated window size: 17520]
    [Window size scaling factor: -2 (no window scaling used)]
    Checksum: 0x6a17 [unverified]
    [Checksum Status: Unverified]
    Urgent Pointer: 0
    [Timestamps]
    [SEQ/ACK analysis]
    TCP payload (1460 bytes)
    [Reassembled PDU in frame: 20]
    TCP segment data (1460 bytes)

No.     Time           Source                Destination           Protocol Length Info
     18 0.037583       192.168.1.164         142.104.5.64          TCP      54     1200 → 80 [ACK] Seq=420 Ack=13141 Win=13140 Len=0

Frame 18: 54 bytes on wire (432 bits), 54 bytes captured (432 bits)
Ethernet II, Src: Intel_a1:48:60 (00:0e:35:a1:48:60), Dst: 3comFast_20:98:c5 (00:10:5a:20:98:c5)
Internet Protocol Version 4, Src: 192.168.1.164, Dst: 142.104.5.64
Transmission Control Protocol, Src Port: 1200, Dst Port: 80, Seq: 420, Ack: 13141, Len: 0
    Source Port: 1200
    Destination Port: 80
    [Stream index: 0]
    [Conversation completeness: Complete, WITH_DATA (63)]
    [TCP Segment Len: 0]
    Sequence Number: 420    (relative sequence number)
    Sequence Number (raw): 2187554669
    [Next Sequence Number: 420    (relative sequence number)]
    Acknowledgment Number: 13141    (relative ack number)
    Acknowledgment number (raw): 625923477
    0101 .... = Header Length: 20 bytes (5)
    Flags: 0x010 (ACK)
    Window: 13140
    [Calculated window size: 13140]
    [Window size scaling factor: -2 (no window scaling used)]
    Checksum: 0x34d7 [unverified]
    [Checksum Status: Unverified]
    Urgent Pointer: 0
    [Timestamps]
    [SEQ/ACK analysis]

No.     Time           Source                Destination           Protocol Length Info
     19 0.039063       142.104.5.64          192.168.1.164         TCP      1514   80 → 1200 [ACK] Seq=13141 Ack=420 Win=17520 Len=1460 [TCP segment of a reassembled PDU]

Frame 19: 1514 bytes on wire (12112 bits), 1514 bytes captured (12112 bits)
Ethernet II, Src: 3comFast_20:98:c5 (00:10:5a:20:98:c5), Dst: Intel_a1:48:60 (00:0e:35:a1:48:60)
Internet Protocol Version 4, Src: 142.104.5.64, Dst: 192.168.1.164
Transmission Control Protocol, Src Port: 80, Dst Port: 1200, Seq: 13141, Ack: 420, Len: 1460
    Source Port: 80
    Destination Port: 1200
    [Stream index: 0]
    [Conversation completeness: Complete, WITH_DATA (63)]
    [TCP Segment Len: 1460]
    Sequence Number: 13141    (relative sequence number)
    Sequence Number (raw): 625923477
    [Next Sequence Number: 14601    (relative sequence number)]
    Acknowledgment Number: 420    (relative ack number)
    Acknowledgment number (raw): 2187554669
    0101 .... = Header Length: 20 bytes (5)
    Flags: 0x010 (ACK)
    Window: 17520
    [Calculated window size: 17520]
    [Window size scaling factor: -2 (no window scaling used)]
    Checksum: 0xfdc6 [unverified]
    [Checksum Status: Unverified]
    Urgent Pointer: 0
    [Timestamps]
    [SEQ/ACK analysis]
    TCP payload (1460 bytes)
    [Reassembled PDU in frame: 20]
    TCP segment data (1460 bytes)

No.     Time           Source                Destination           Protocol Length Info
     20 0.040795       142.104.5.64          192.168.1.164         HTTP     1426   HTTP/1.1 200 OK  (text/html)

Frame 20: 1426 bytes on wire (11408 bits), 1426 bytes captured (11408 bits)
Ethernet II, Src: 3comFast_20:98:c5 (00:10:5a:20:98:c5), Dst: Intel_a1:48:60 (00:0e:35:a1:48:60)
Internet Protocol Version 4, Src: 142.104.5.64, Dst: 192.168.1.164
Transmission Control Protocol, Src Port: 80, Dst Port: 1200, Seq: 14601, Ack: 420, Len: 1372
    Source Port: 80
    Destination Port: 1200
    [Stream index: 0]
    [Conversation completeness: Complete, WITH_DATA (63)]
    [TCP Segment Len: 1372]
    Sequence Number: 14601    (relative sequence number)
    Sequence Number (raw): 625924937
    [Next Sequence Number: 15973    (relative sequence number)]
    Acknowledgment Number: 420    (relative ack number)
    Acknowledgment number (raw): 2187554669
    0101 .... = Header Length: 20 bytes (5)
    Flags: 0x018 (PSH, ACK)
    Window: 17520
    [Calculated window size: 17520]
    [Window size scaling factor: -2 (no window scaling used)]
    Checksum: 0x86e8 [unverified]
    [Checksum Status: Unverified]
    Urgent Pointer: 0
    [Timestamps]
    [SEQ/ACK analysis]
    TCP payload (1372 bytes)
    TCP segment data (1372 bytes)
[11 Reassembled TCP Segments (15972 bytes): #5(1460), #6(1460), #8(1460), #9(1460), #11(1460), #12(1460), #14(1460), #16(1460), #17(1460), #19(1460), #20(1372)]
Hypertext Transfer Protocol
Line-based text data: text/html (193 lines)

No.     Time           Source                Destination           Protocol Length Info
     21 0.040811       192.168.1.164         142.104.5.64          TCP      54     1200 → 80 [ACK] Seq=420 Ack=15973 Win=10308 Len=0

Frame 21: 54 bytes on wire (432 bits), 54 bytes captured (432 bits)
Ethernet II, Src: Intel_a1:48:60 (00:0e:35:a1:48:60), Dst: 3comFast_20:98:c5 (00:10:5a:20:98:c5)
Internet Protocol Version 4, Src: 192.168.1.164, Dst: 142.104.5.64
Transmission Control Protocol, Src Port: 1200, Dst Port: 80, Seq: 420, Ack: 15973, Len: 0
    Source Port: 1200
    Destination Port: 80
    [Stream index: 0]
    [Conversation completeness: Complete, WITH_DATA (63)]
    [TCP Segment Len: 0]
    Sequence Number: 420    (relative sequence number)
    Sequence Number (raw): 2187554669
    [Next Sequence Number: 420    (relative sequence number)]
    Acknowledgment Number: 15973    (relative ack number)
    Acknowledgment number (raw): 625926309
    0101 .... = Header Length: 20 bytes (5)
    Flags: 0x010 (ACK)
    Window: 10308
    [Calculated window size: 10308]
    [Window size scaling factor: -2 (no window scaling used)]
    Checksum: 0x34d7 [unverified]
    [Checksum Status: Unverified]
    Urgent Pointer: 0
    [Timestamps]
    [SEQ/ACK analysis]

No.     Time           Source                Destination           Protocol Length Info
     22 0.291372       192.168.1.164         142.104.5.64          TCP      54     [TCP Window Update] 1200 → 80 [ACK] Seq=420 Ack=15973 Win=17520 Len=0

Frame 22: 54 bytes on wire (432 bits), 54 bytes captured (432 bits)
Ethernet II, Src: Intel_a1:48:60 (00:0e:35:a1:48:60), Dst: 3comFast_20:98:c5 (00:10:5a:20:98:c5)
Internet Protocol Version 4, Src: 192.168.1.164, Dst: 142.104.5.64
Transmission Control Protocol, Src Port: 1200, Dst Port: 80, Seq: 420, Ack: 15973, Len: 0
    Source Port: 1200
    Destination Port: 80
    [Stream index: 0]
    [Conversation completeness: Complete, WITH_DATA (63)]
    [TCP Segment Len: 0]
    Sequence Number: 420    (relative sequence number)
    Sequence Number (raw): 2187554669
    [Next Sequence Number: 420    (relative sequence number)]
    Acknowledgment Number: 15973    (relative ack number)
    Acknowledgment number (raw): 625926309
    0101 .... = Header Length: 20 bytes (5)
    Flags: 0x010 (ACK)
    Window: 17520
    [Calculated window size: 17520]
    [Window size scaling factor: -2 (no window scaling used)]
    Checksum: 0x18ab [unverified]
    [Checksum Status: Unverified]
    Urgent Pointer: 0
    [Timestamps]
    [SEQ/ACK analysis]

No.     Time           Source                Destination           Protocol Length Info
     23 2.607847       192.168.1.164         142.104.5.64          HTTP     491    GET /about/welcome.html HTTP/1.1 

Frame 23: 491 bytes on wire (3928 bits), 491 bytes captured (3928 bits)
Ethernet II, Src: Intel_a1:48:60 (00:0e:35:a1:48:60), Dst: 3comFast_20:98:c5 (00:10:5a:20:98:c5)
Internet Protocol Version 4, Src: 192.168.1.164, Dst: 142.104.5.64
Transmission Control Protocol, Src Port: 1200, Dst Port: 80, Seq: 420, Ack: 15973, Len: 437
    Source Port: 1200
    Destination Port: 80
    [Stream index: 0]
    [Conversation completeness: Complete, WITH_DATA (63)]
    [TCP Segment Len: 437]
    Sequence Number: 420    (relative sequence number)
    Sequence Number (raw): 2187554669
    [Next Sequence Number: 857    (relative sequence number)]
    Acknowledgment Number: 15973    (relative ack number)
    Acknowledgment number (raw): 625926309
    0101 .... = Header Length: 20 bytes (5)
    Flags: 0x018 (PSH, ACK)
    Window: 17520
    [Calculated window size: 17520]
    [Window size scaling factor: -2 (no window scaling used)]
    Checksum: 0x8ea5 [unverified]
    [Checksum Status: Unverified]
    Urgent Pointer: 0
    [Timestamps]
    [SEQ/ACK analysis]
    TCP payload (437 bytes)
Hypertext Transfer Protocol

No.     Time           Source                Destination           Protocol Length Info
     24 2.632146       142.104.5.64          192.168.1.164         TCP      1514   80 → 1200 [ACK] Seq=15973 Ack=857 Win=17520 Len=1460 [TCP segment of a reassembled PDU]

Frame 24: 1514 bytes on wire (12112 bits), 1514 bytes captured (12112 bits)
Ethernet II, Src: 3comFast_20:98:c5 (00:10:5a:20:98:c5), Dst: Intel_a1:48:60 (00:0e:35:a1:48:60)
Internet Protocol Version 4, Src: 142.104.5.64, Dst: 192.168.1.164
Transmission Control Protocol, Src Port: 80, Dst Port: 1200, Seq: 15973, Ack: 857, Len: 1460
    Source Port: 80
    Destination Port: 1200
    [Stream index: 0]
    [Conversation completeness: Complete, WITH_DATA (63)]
    [TCP Segment Len: 1460]
    Sequence Number: 15973    (relative sequence number)
    Sequence Number (raw): 625926309
    [Next Sequence Number: 17433    (relative sequence number)]
    Acknowledgment Number: 857    (relative ack number)
    Acknowledgment number (raw): 2187555106
    0101 .... = Header Length: 20 bytes (5)
    Flags: 0x010 (ACK)
    Window: 17520
    [Calculated window size: 17520]
    [Window size scaling factor: -2 (no window scaling used)]
    Checksum: 0x8218 [unverified]
    [Checksum Status: Unverified]
    Urgent Pointer: 0
    [Timestamps]
    [SEQ/ACK analysis]
    TCP payload (1460 bytes)
    [Reassembled PDU in frame: 42]
    TCP segment data (1460 bytes)

No.     Time           Source                Destination           Protocol Length Info
     25 2.633580       142.104.5.64          192.168.1.164         TCP      1514   80 → 1200 [ACK] Seq=17433 Ack=857 Win=17520 Len=1460 [TCP segment of a reassembled PDU]

Frame 25: 1514 bytes on wire (12112 bits), 1514 bytes captured (12112 bits)
Ethernet II, Src: 3comFast_20:98:c5 (00:10:5a:20:98:c5), Dst: Intel_a1:48:60 (00:0e:35:a1:48:60)
Internet Protocol Version 4, Src: 142.104.5.64, Dst: 192.168.1.164
Transmission Control Protocol, Src Port: 80, Dst Port: 1200, Seq: 17433, Ack: 857, Len: 1460
    Source Port: 80
    Destination Port: 1200
    [Stream index: 0]
    [Conversation completeness: Complete, WITH_DATA (63)]
    [TCP Segment Len: 1460]
    Sequence Number: 17433    (relative sequence number)
    Sequence Number (raw): 625927769
    [Next Sequence Number: 18893    (relative sequence number)]
    Acknowledgment Number: 857    (relative ack number)
    Acknowledgment number (raw): 2187555106
    0101 .... = Header Length: 20 bytes (5)
    Flags: 0x010 (ACK)
    Window: 17520
    [Calculated window size: 17520]
    [Window size scaling factor: -2 (no window scaling used)]
    Checksum: 0xeba3 [unverified]
    [Checksum Status: Unverified]
    Urgent Pointer: 0
    [Timestamps]
    [SEQ/ACK analysis]
    TCP payload (1460 bytes)
    [Reassembled PDU in frame: 42]
    TCP segment data (1460 bytes)

No.     Time           Source                Destination           Protocol Length Info
     26 2.633599       192.168.1.164         142.104.5.64          TCP      54     1200 → 80 [ACK] Seq=857 Ack=18893 Win=17520 Len=0

Frame 26: 54 bytes on wire (432 bits), 54 bytes captured (432 bits)
Ethernet II, Src: Intel_a1:48:60 (00:0e:35:a1:48:60), Dst: 3comFast_20:98:c5 (00:10:5a:20:98:c5)
Internet Protocol Version 4, Src: 192.168.1.164, Dst: 142.104.5.64
Transmission Control Protocol, Src Port: 1200, Dst Port: 80, Seq: 857, Ack: 18893, Len: 0
    Source Port: 1200
    Destination Port: 80
    [Stream index: 0]
    [Conversation completeness: Complete, WITH_DATA (63)]
    [TCP Segment Len: 0]
    Sequence Number: 857    (relative sequence number)
    Sequence Number (raw): 2187555106
    [Next Sequence Number: 857    (relative sequence number)]
    Acknowledgment Number: 18893    (relative ack number)
    Acknowledgment number (raw): 625929229
    0101 .... = Header Length: 20 bytes (5)
    Flags: 0x010 (ACK)
    Window: 17520
    [Calculated window size: 17520]
    [Window size scaling factor: -2 (no window scaling used)]
    Checksum: 0x0b8e [unverified]
    [Checksum Status: Unverified]
    Urgent Pointer: 0
    [Timestamps]
    [SEQ/ACK analysis]

No.     Time           Source                Destination           Protocol Length Info
     27 2.635054       142.104.5.64          192.168.1.164         TCP      1514   80 → 1200 [ACK] Seq=18893 Ack=857 Win=17520 Len=1460 [TCP segment of a reassembled PDU]

Frame 27: 1514 bytes on wire (12112 bits), 1514 bytes captured (12112 bits)
Ethernet II, Src: 3comFast_20:98:c5 (00:10:5a:20:98:c5), Dst: Intel_a1:48:60 (00:0e:35:a1:48:60)
Internet Protocol Version 4, Src: 142.104.5.64, Dst: 192.168.1.164
Transmission Control Protocol, Src Port: 80, Dst Port: 1200, Seq: 18893, Ack: 857, Len: 1460
    Source Port: 80
    Destination Port: 1200
    [Stream index: 0]
    [Conversation completeness: Complete, WITH_DATA (63)]
    [TCP Segment Len: 1460]
    Sequence Number: 18893    (relative sequence number)
    Sequence Number (raw): 625929229
    [Next Sequence Number: 20353    (relative sequence number)]
    Acknowledgment Number: 857    (relative ack number)
    Acknowledgment number (raw): 2187555106
    0101 .... = Header Length: 20 bytes (5)
    Flags: 0x010 (ACK)
    Window: 17520
    [Calculated window size: 17520]
    [Window size scaling factor: -2 (no window scaling used)]
    Checksum: 0x2619 [unverified]
    [Checksum Status: Unverified]
    Urgent Pointer: 0
    [Timestamps]
    [SEQ/ACK analysis]
    TCP payload (1460 bytes)
    [Reassembled PDU in frame: 42]
    TCP segment data (1460 bytes)

No.     Time           Source                Destination           Protocol Length Info
     28 2.636436       142.104.5.64          192.168.1.164         TCP      1514   80 → 1200 [ACK] Seq=20353 Ack=857 Win=17520 Len=1460 [TCP segment of a reassembled PDU]

Frame 28: 1514 bytes on wire (12112 bits), 1514 bytes captured (12112 bits)
Ethernet II, Src: 3comFast_20:98:c5 (00:10:5a:20:98:c5), Dst: Intel_a1:48:60 (00:0e:35:a1:48:60)
Internet Protocol Version 4, Src: 142.104.5.64, Dst: 192.168.1.164
Transmission Control Protocol, Src Port: 80, Dst Port: 1200, Seq: 20353, Ack: 857, Len: 1460
    Source Port: 80
    Destination Port: 1200
    [Stream index: 0]
    [Conversation completeness: Complete, WITH_DATA (63)]
    [TCP Segment Len: 1460]
    Sequence Number: 20353    (relative sequence number)
    Sequence Number (raw): 625930689
    [Next Sequence Number: 21813    (relative sequence number)]
    Acknowledgment Number: 857    (relative ack number)
    Acknowledgment number (raw): 2187555106
    0101 .... = Header Length: 20 bytes (5)
    Flags: 0x010 (ACK)
    Window: 17520
    [Calculated window size: 17520]
    [Window size scaling factor: -2 (no window scaling used)]
    Checksum: 0x6b69 [unverified]
    [Checksum Status: Unverified]
    Urgent Pointer: 0
    [Timestamps]
    [SEQ/ACK analysis]
    TCP payload (1460 bytes)
    [Reassembled PDU in frame: 42]
    TCP segment data (1460 bytes)

No.     Time           Source                Destination           Protocol Length Info
     29 2.636450       192.168.1.164         142.104.5.64          TCP      54     1200 → 80 [ACK] Seq=857 Ack=21813 Win=17520 Len=0

Frame 29: 54 bytes on wire (432 bits), 54 bytes captured (432 bits)
Ethernet II, Src: Intel_a1:48:60 (00:0e:35:a1:48:60), Dst: 3comFast_20:98:c5 (00:10:5a:20:98:c5)
Internet Protocol Version 4, Src: 192.168.1.164, Dst: 142.104.5.64
Transmission Control Protocol, Src Port: 1200, Dst Port: 80, Seq: 857, Ack: 21813, Len: 0
    Source Port: 1200
    Destination Port: 80
    [Stream index: 0]
    [Conversation completeness: Complete, WITH_DATA (63)]
    [TCP Segment Len: 0]
    Sequence Number: 857    (relative sequence number)
    Sequence Number (raw): 2187555106
    [Next Sequence Number: 857    (relative sequence number)]
    Acknowledgment Number: 21813    (relative ack number)
    Acknowledgment number (raw): 625932149
    0101 .... = Header Length: 20 bytes (5)
    Flags: 0x010 (ACK)
    Window: 17520
    [Calculated window size: 17520]
    [Window size scaling factor: -2 (no window scaling used)]
    Checksum: 0x0026 [unverified]
    [Checksum Status: Unverified]
    Urgent Pointer: 0
    [Timestamps]
    [SEQ/ACK analysis]

No.     Time           Source                Destination           Protocol Length Info
     30 2.638154       142.104.5.64          192.168.1.164         TCP      1514   80 → 1200 [ACK] Seq=21813 Ack=857 Win=17520 Len=1460 [TCP segment of a reassembled PDU]

Frame 30: 1514 bytes on wire (12112 bits), 1514 bytes captured (12112 bits)
Ethernet II, Src: 3comFast_20:98:c5 (00:10:5a:20:98:c5), Dst: Intel_a1:48:60 (00:0e:35:a1:48:60)
Internet Protocol Version 4, Src: 142.104.5.64, Dst: 192.168.1.164
Transmission Control Protocol, Src Port: 80, Dst Port: 1200, Seq: 21813, Ack: 857, Len: 1460
    Source Port: 80
    Destination Port: 1200
    [Stream index: 0]
    [Conversation completeness: Complete, WITH_DATA (63)]
    [TCP Segment Len: 1460]
    Sequence Number: 21813    (relative sequence number)
    Sequence Number (raw): 625932149
