No.     Time           Source                Destination           Protocol Length Info
      1 0.000000000    192.168.100.17        8.8.8.8               DNS      78     Standard query 0x5bf1 A connex.csc.uvic.ca

Frame 1: 78 bytes on wire (624 bits), 78 bytes captured (624 bits)
Ethernet II, Src: Dell_0c:7f:fa (f0:4d:a2:0c:7f:fa), Dst: Netgear_6b:0d:fc (00:0f:b5:6b:0d:fc)
    Destination: Netgear_6b:0d:fc (00:0f:b5:6b:0d:fc)
        Address: Netgear_6b:0d:fc (00:0f:b5:6b:0d:fc)
        .... ..0. .... .... .... .... = LG bit: Globally unique address (factory default)
        .... ...0 .... .... .... .... = IG bit: Individual address (unicast)
    Source: Dell_0c:7f:fa (f0:4d:a2:0c:7f:fa)
        Address: Dell_0c:7f:fa (f0:4d:a2:0c:7f:fa)
        .... ..0. .... .... .... .... = LG bit: Globally unique address (factory default)
        .... ...0 .... .... .... .... = IG bit: Individual address (unicast)
    Type: IPv4 (0x0800)
Internet Protocol Version 4, Src: 192.168.100.17, Dst: 8.8.8.8
User Datagram Protocol, Src Port: 50420, Dst Port: 53
Domain Name System (query)

No.     Time           Source                Destination           Protocol Length Info
      2 0.000036000    192.168.100.17        8.8.8.8               DNS      78     Standard query 0x1fa8 AAAA connex.csc.uvic.ca

Frame 2: 78 bytes on wire (624 bits), 78 bytes captured (624 bits)
Ethernet II, Src: Dell_0c:7f:fa (f0:4d:a2:0c:7f:fa), Dst: Netgear_6b:0d:fc (00:0f:b5:6b:0d:fc)
    Destination: Netgear_6b:0d:fc (00:0f:b5:6b:0d:fc)
        Address: Netgear_6b:0d:fc (00:0f:b5:6b:0d:fc)
        .... ..0. .... .... .... .... = LG bit: Globally unique address (factory default)
        .... ...0 .... .... .... .... = IG bit: Individual address (unicast)
    Source: Dell_0c:7f:fa (f0:4d:a2:0c:7f:fa)
        Address: Dell_0c:7f:fa (f0:4d:a2:0c:7f:fa)
        .... ..0. .... .... .... .... = LG bit: Globally unique address (factory default)
        .... ...0 .... .... .... .... = IG bit: Individual address (unicast)
    Type: IPv4 (0x0800)
Internet Protocol Version 4, Src: 192.168.100.17, Dst: 8.8.8.8
User Datagram Protocol, Src Port: 50420, Dst Port: 53
Domain Name System (query)

No.     Time           Source                Destination           Protocol Length Info
      3 0.000047000    192.168.100.17        142.104.71.81         TCP      74     34880 → 443 [SYN] Seq=0 Win=29200 Len=0 MSS=1460 SACK_PERM TSval=63930217 TSecr=0 WS=128

Frame 3: 74 bytes on wire (592 bits), 74 bytes captured (592 bits)
Ethernet II, Src: Dell_0c:7f:fa (f0:4d:a2:0c:7f:fa), Dst: Netgear_6b:0d:fc (00:0f:b5:6b:0d:fc)
    Destination: Netgear_6b:0d:fc (00:0f:b5:6b:0d:fc)
        Address: Netgear_6b:0d:fc (00:0f:b5:6b:0d:fc)
        .... ..0. .... .... .... .... = LG bit: Globally unique address (factory default)
        .... ...0 .... .... .... .... = IG bit: Individual address (unicast)
    Source: Dell_0c:7f:fa (f0:4d:a2:0c:7f:fa)
        Address: Dell_0c:7f:fa (f0:4d:a2:0c:7f:fa)
        .... ..0. .... .... .... .... = LG bit: Globally unique address (factory default)
        .... ...0 .... .... .... .... = IG bit: Individual address (unicast)
    Type: IPv4 (0x0800)
Internet Protocol Version 4, Src: 192.168.100.17, Dst: 142.104.71.81
Transmission Control Protocol, Src Port: 34880, Dst Port: 443, Seq: 0, Len: 0

No.     Time           Source                Destination           Protocol Length Info
      4 0.004009000    142.104.71.81         192.168.100.17        TCP      74     443 → 34880 [SYN, ACK] Seq=0 Ack=1 Win=28960 Len=0 MSS=1460 SACK_PERM TSval=1232117278 TSecr=63930217 WS=128

Frame 4: 74 bytes on wire (592 bits), 74 bytes captured (592 bits)
Ethernet II, Src: Netgear_6b:0d:fc (00:0f:b5:6b:0d:fc), Dst: Dell_0c:7f:fa (f0:4d:a2:0c:7f:fa)
    Destination: Dell_0c:7f:fa (f0:4d:a2:0c:7f:fa)
        Address: Dell_0c:7f:fa (f0:4d:a2:0c:7f:fa)
        .... ..0. .... .... .... .... = LG bit: Globally unique address (factory default)
        .... ...0 .... .... .... .... = IG bit: Individual address (unicast)
    Source: Netgear_6b:0d:fc (00:0f:b5:6b:0d:fc)
        Address: Netgear_6b:0d:fc (00:0f:b5:6b:0d:fc)
        .... ..0. .... .... .... .... = LG bit: Globally unique address (factory default)
        .... ...0 .... .... .... .... = IG bit: Individual address (unicast)
    Type: IPv4 (0x0800)
Internet Protocol Version 4, Src: 142.104.71.81, Dst: 192.168.100.17
Transmission Control Protocol, Src Port: 443, Dst Port: 34880, Seq: 0, Ack: 1, Len: 0

No.     Time           Source                Destination           Protocol Length Info
      5 0.004050000    192.168.100.17        142.104.71.81         TCP      66     34880 → 443 [ACK] Seq=1 Ack=1 Win=29312 Len=0 TSval=63930218 TSecr=1232117278

Frame 5: 66 bytes on wire (528 bits), 66 bytes captured (528 bits)
Ethernet II, Src: Dell_0c:7f:fa (f0:4d:a2:0c:7f:fa), Dst: Netgear_6b:0d:fc (00:0f:b5:6b:0d:fc)
    Destination: Netgear_6b:0d:fc (00:0f:b5:6b:0d:fc)
        Address: Netgear_6b:0d:fc (00:0f:b5:6b:0d:fc)
        .... ..0. .... .... .... .... = LG bit: Globally unique address (factory default)
        .... ...0 .... .... .... .... = IG bit: Individual address (unicast)
    Source: Dell_0c:7f:fa (f0:4d:a2:0c:7f:fa)
        Address: Dell_0c:7f:fa (f0:4d:a2:0c:7f:fa)
        .... ..0. .... .... .... .... = LG bit: Globally unique address (factory default)
        .... ...0 .... .... .... .... = IG bit: Individual address (unicast)
    Type: IPv4 (0x0800)
Internet Protocol Version 4, Src: 192.168.100.17, Dst: 142.104.71.81
Transmission Control Protocol, Src Port: 34880, Dst Port: 443, Seq: 1, Ack: 1, Len: 0

No.     Time           Source                Destination           Protocol Length Info
      6 0.004166000    192.168.100.17        142.104.71.81         TLSv1.2  583    Client Hello

Frame 6: 583 bytes on wire (4664 bits), 583 bytes captured (4664 bits)
Ethernet II, Src: Dell_0c:7f:fa (f0:4d:a2:0c:7f:fa), Dst: Netgear_6b:0d:fc (00:0f:b5:6b:0d:fc)
    Destination: Netgear_6b:0d:fc (00:0f:b5:6b:0d:fc)
        Address: Netgear_6b:0d:fc (00:0f:b5:6b:0d:fc)
        .... ..0. .... .... .... .... = LG bit: Globally unique address (factory default)
        .... ...0 .... .... .... .... = IG bit: Individual address (unicast)
    Source: Dell_0c:7f:fa (f0:4d:a2:0c:7f:fa)
        Address: Dell_0c:7f:fa (f0:4d:a2:0c:7f:fa)
        .... ..0. .... .... .... .... = LG bit: Globally unique address (factory default)
        .... ...0 .... .... .... .... = IG bit: Individual address (unicast)
    Type: IPv4 (0x0800)
Internet Protocol Version 4, Src: 192.168.100.17, Dst: 142.104.71.81
Transmission Control Protocol, Src Port: 34880, Dst Port: 443, Seq: 1, Ack: 1, Len: 517
Transport Layer Security

No.     Time           Source                Destination           Protocol Length Info
      7 0.006574000    142.104.71.81         192.168.100.17        TCP      66     443 → 34880 [ACK] Seq=1 Ack=518 Win=30080 Len=0 TSval=1232117279 TSecr=63930218

Frame 7: 66 bytes on wire (528 bits), 66 bytes captured (528 bits)
Ethernet II, Src: Netgear_6b:0d:fc (00:0f:b5:6b:0d:fc), Dst: Dell_0c:7f:fa (f0:4d:a2:0c:7f:fa)
    Destination: Dell_0c:7f:fa (f0:4d:a2:0c:7f:fa)
        Address: Dell_0c:7f:fa (f0:4d:a2:0c:7f:fa)
        .... ..0. .... .... .... .... = LG bit: Globally unique address (factory default)
        .... ...0 .... .... .... .... = IG bit: Individual address (unicast)
    Source: Netgear_6b:0d:fc (00:0f:b5:6b:0d:fc)
        Address: Netgear_6b:0d:fc (00:0f:b5:6b:0d:fc)
        .... ..0. .... .... .... .... = LG bit: Globally unique address (factory default)
        .... ...0 .... .... .... .... = IG bit: Individual address (unicast)
    Type: IPv4 (0x0800)
Internet Protocol Version 4, Src: 142.104.71.81, Dst: 192.168.100.17
Transmission Control Protocol, Src Port: 443, Dst Port: 34880, Seq: 1, Ack: 518, Len: 0

No.     Time           Source                Destination           Protocol Length Info
      8 0.007898000    142.104.71.81         192.168.100.17        TLSv1.2  203    Server Hello, Change Cipher Spec, Encrypted Handshake Message

Frame 8: 203 bytes on wire (1624 bits), 203 bytes captured (1624 bits)
Ethernet II, Src: Netgear_6b:0d:fc (00:0f:b5:6b:0d:fc), Dst: Dell_0c:7f:fa (f0:4d:a2:0c:7f:fa)
    Destination: Dell_0c:7f:fa (f0:4d:a2:0c:7f:fa)
        Address: Dell_0c:7f:fa (f0:4d:a2:0c:7f:fa)
        .... ..0. .... .... .... .... = LG bit: Globally unique address (factory default)
        .... ...0 .... .... .... .... = IG bit: Individual address (unicast)
    Source: Netgear_6b:0d:fc (00:0f:b5:6b:0d:fc)
        Address: Netgear_6b:0d:fc (00:0f:b5:6b:0d:fc)
        .... ..0. .... .... .... .... = LG bit: Globally unique address (factory default)
        .... ...0 .... .... .... .... = IG bit: Individual address (unicast)
    Type: IPv4 (0x0800)
Internet Protocol Version 4, Src: 142.104.71.81, Dst: 192.168.100.17
Transmission Control Protocol, Src Port: 443, Dst Port: 34880, Seq: 1, Ack: 518, Len: 137
Transport Layer Security

No.     Time           Source                Destination           Protocol Length Info
      9 0.007905000    192.168.100.17        142.104.71.81         TCP      66     34880 → 443 [ACK] Seq=518 Ack=138 Win=30336 Len=0 TSval=63930219 TSecr=1232117279

Frame 9: 66 bytes on wire (528 bits), 66 bytes captured (528 bits)
Ethernet II, Src: Dell_0c:7f:fa (f0:4d:a2:0c:7f:fa), Dst: Netgear_6b:0d:fc (00:0f:b5:6b:0d:fc)
    Destination: Netgear_6b:0d:fc (00:0f:b5:6b:0d:fc)
        Address: Netgear_6b:0d:fc (00:0f:b5:6b:0d:fc)
        .... ..0. .... .... .... .... = LG bit: Globally unique address (factory default)
        .... ...0 .... .... .... .... = IG bit: Individual address (unicast)
    Source: Dell_0c:7f:fa (f0:4d:a2:0c:7f:fa)
        Address: Dell_0c:7f:fa (f0:4d:a2:0c:7f:fa)
        .... ..0. .... .... .... .... = LG bit: Globally unique address (factory default)
        .... ...0 .... .... .... .... = IG bit: Individual address (unicast)
    Type: IPv4 (0x0800)
Internet Protocol Version 4, Src: 192.168.100.17, Dst: 142.104.71.81
Transmission Control Protocol, Src Port: 34880, Dst Port: 443, Seq: 518, Ack: 138, Len: 0

No.     Time           Source                Destination           Protocol Length Info
     10 0.017076000    8.8.8.8               192.168.100.17        DNS      94     Standard query response 0x5bf1 A connex.csc.uvic.ca A 142.104.71.81

Frame 10: 94 bytes on wire (752 bits), 94 bytes captured (752 bits)
Ethernet II, Src: Netgear_6b:0d:fc (00:0f:b5:6b:0d:fc), Dst: Dell_0c:7f:fa (f0:4d:a2:0c:7f:fa)
    Destination: Dell_0c:7f:fa (f0:4d:a2:0c:7f:fa)
        Address: Dell_0c:7f:fa (f0:4d:a2:0c:7f:fa)
        .... ..0. .... .... .... .... = LG bit: Globally unique address (factory default)
        .... ...0 .... .... .... .... = IG bit: Individual address (unicast)
    Source: Netgear_6b:0d:fc (00:0f:b5:6b:0d:fc)
        Address: Netgear_6b:0d:fc (00:0f:b5:6b:0d:fc)
        .... ..0. .... .... .... .... = LG bit: Globally unique address (factory default)
        .... ...0 .... .... .... .... = IG bit: Individual address (unicast)
    Type: IPv4 (0x0800)
Internet Protocol Version 4, Src: 8.8.8.8, Dst: 192.168.100.17
User Datagram Protocol, Src Port: 53, Dst Port: 50420
Domain Name System (response)

No.     Time           Source                Destination           Protocol Length Info
     11 0.017709000    8.8.8.8               192.168.100.17        DNS      131    Standard query response 0x1fa8 AAAA connex.csc.uvic.ca SOA ns2.engr.uvic.ca

Frame 11: 131 bytes on wire (1048 bits), 131 bytes captured (1048 bits)
Ethernet II, Src: Netgear_6b:0d:fc (00:0f:b5:6b:0d:fc), Dst: Dell_0c:7f:fa (f0:4d:a2:0c:7f:fa)
    Destination: Dell_0c:7f:fa (f0:4d:a2:0c:7f:fa)
        Address: Dell_0c:7f:fa (f0:4d:a2:0c:7f:fa)
        .... ..0. .... .... .... .... = LG bit: Globally unique address (factory default)
        .... ...0 .... .... .... .... = IG bit: Individual address (unicast)
    Source: Netgear_6b:0d:fc (00:0f:b5:6b:0d:fc)
        Address: Netgear_6b:0d:fc (00:0f:b5:6b:0d:fc)
        .... ..0. .... .... .... .... = LG bit: Globally unique address (factory default)
        .... ...0 .... .... .... .... = IG bit: Individual address (unicast)
    Type: IPv4 (0x0800)
Internet Protocol Version 4, Src: 8.8.8.8, Dst: 192.168.100.17
User Datagram Protocol, Src Port: 53, Dst Port: 50420
Domain Name System (response)

No.     Time           Source                Destination           Protocol Length Info
     12 0.030271000    192.168.100.17        142.104.71.81         TLSv1.2  117    Change Cipher Spec, Encrypted Handshake Message

Frame 12: 117 bytes on wire (936 bits), 117 bytes captured (936 bits)
Ethernet II, Src: Dell_0c:7f:fa (f0:4d:a2:0c:7f:fa), Dst: Netgear_6b:0d:fc (00:0f:b5:6b:0d:fc)
    Destination: Netgear_6b:0d:fc (00:0f:b5:6b:0d:fc)
        Address: Netgear_6b:0d:fc (00:0f:b5:6b:0d:fc)
        .... ..0. .... .... .... .... = LG bit: Globally unique address (factory default)
        .... ...0 .... .... .... .... = IG bit: Individual address (unicast)
    Source: Dell_0c:7f:fa (f0:4d:a2:0c:7f:fa)
        Address: Dell_0c:7f:fa (f0:4d:a2:0c:7f:fa)
        .... ..0. .... .... .... .... = LG bit: Globally unique address (factory default)
        .... ...0 .... .... .... .... = IG bit: Individual address (unicast)
    Type: IPv4 (0x0800)
Internet Protocol Version 4, Src: 192.168.100.17, Dst: 142.104.71.81
Transmission Control Protocol, Src Port: 34880, Dst Port: 443, Seq: 518, Ack: 138, Len: 51
Transport Layer Security

No.     Time           Source                Destination           Protocol Length Info
     13 0.030371000    192.168.100.17        142.104.71.81         TLSv1.2  888    Application Data

Frame 13: 888 bytes on wire (7104 bits), 888 bytes captured (7104 bits)
Ethernet II, Src: Dell_0c:7f:fa (f0:4d:a2:0c:7f:fa), Dst: Netgear_6b:0d:fc (00:0f:b5:6b:0d:fc)
    Destination: Netgear_6b:0d:fc (00:0f:b5:6b:0d:fc)
        Address: Netgear_6b:0d:fc (00:0f:b5:6b:0d:fc)
        .... ..0. .... .... .... .... = LG bit: Globally unique address (factory default)
        .... ...0 .... .... .... .... = IG bit: Individual address (unicast)
    Source: Dell_0c:7f:fa (f0:4d:a2:0c:7f:fa)
        Address: Dell_0c:7f:fa (f0:4d:a2:0c:7f:fa)
        .... ..0. .... .... .... .... = LG bit: Globally unique address (factory default)
        .... ...0 .... .... .... .... = IG bit: Individual address (unicast)
    Type: IPv4 (0x0800)
Internet Protocol Version 4, Src: 192.168.100.17, Dst: 142.104.71.81
Transmission Control Protocol, Src Port: 34880, Dst Port: 443, Seq: 569, Ack: 138, Len: 822
Transport Layer Security

No.     Time           Source                Destination           Protocol Length Info
     14 0.032624000    142.104.71.81         192.168.100.17        TCP      66     443 → 34880 [ACK] Seq=138 Ack=1391 Win=31744 Len=0 TSval=1232117285 TSecr=63930224

Frame 14: 66 bytes on wire (528 bits), 66 bytes captured (528 bits)
Ethernet II, Src: Netgear_6b:0d:fc (00:0f:b5:6b:0d:fc), Dst: Dell_0c:7f:fa (f0:4d:a2:0c:7f:fa)
    Destination: Dell_0c:7f:fa (f0:4d:a2:0c:7f:fa)
        Address: Dell_0c:7f:fa (f0:4d:a2:0c:7f:fa)
        .... ..0. .... .... .... .... = LG bit: Globally unique address (factory default)
        .... ...0 .... .... .... .... = IG bit: Individual address (unicast)
    Source: Netgear_6b:0d:fc (00:0f:b5:6b:0d:fc)
        Address: Netgear_6b:0d:fc (00:0f:b5:6b:0d:fc)
        .... ..0. .... .... .... .... = LG bit: Globally unique address (factory default)
        .... ...0 .... .... .... .... = IG bit: Individual address (unicast)
    Type: IPv4 (0x0800)
Internet Protocol Version 4, Src: 142.104.71.81, Dst: 192.168.100.17
Transmission Control Protocol, Src Port: 443, Dst Port: 34880, Seq: 138, Ack: 1391, Len: 0

No.     Time           Source                Destination           Protocol Length Info
     15 0.060778000    142.104.71.81         192.168.100.17        TLSv1.2  932    Application Data, Application Data, Application Data

Frame 15: 932 bytes on wire (7456 bits), 932 bytes captured (7456 bits)
Ethernet II, Src: Netgear_6b:0d:fc (00:0f:b5:6b:0d:fc), Dst: Dell_0c:7f:fa (f0:4d:a2:0c:7f:fa)
    Destination: Dell_0c:7f:fa (f0:4d:a2:0c:7f:fa)
        Address: Dell_0c:7f:fa (f0:4d:a2:0c:7f:fa)
        .... ..0. .... .... .... .... = LG bit: Globally unique address (factory default)
        .... ...0 .... .... .... .... = IG bit: Individual address (unicast)
    Source: Netgear_6b:0d:fc (00:0f:b5:6b:0d:fc)
        Address: Netgear_6b:0d:fc (00:0f:b5:6b:0d:fc)
        .... ..0. .... .... .... .... = LG bit: Globally unique address (factory default)
        .... ...0 .... .... .... .... = IG bit: Individual address (unicast)
    Type: IPv4 (0x0800)
Internet Protocol Version 4, Src: 142.104.71.81, Dst: 192.168.100.17
Transmission Control Protocol, Src Port: 443, Dst Port: 34880, Seq: 138, Ack: 1391, Len: 866
Transport Layer Security

No.     Time           Source                Destination           Protocol Length Info
     16 0.098602000    192.168.100.17        142.104.71.81         TCP      66     34880 → 443 [ACK] Seq=1391 Ack=1004 Win=32128 Len=0 TSval=63930242 TSecr=1232117292

Frame 16: 66 bytes on wire (528 bits), 66 bytes captured (528 bits)
Ethernet II, Src: Dell_0c:7f:fa (f0:4d:a2:0c:7f:fa), Dst: Netgear_6b:0d:fc (00:0f:b5:6b:0d:fc)
    Destination: Netgear_6b:0d:fc (00:0f:b5:6b:0d:fc)
        Address: Netgear_6b:0d:fc (00:0f:b5:6b:0d:fc)
        .... ..0. .... .... .... .... = LG bit: Globally unique address (factory default)
        .... ...0 .... .... .... .... = IG bit: Individual address (unicast)
    Source: Dell_0c:7f:fa (f0:4d:a2:0c:7f:fa)
        Address: Dell_0c:7f:fa (f0:4d:a2:0c:7f:fa)
        .... ..0. .... .... .... .... = LG bit: Globally unique address (factory default)
        .... ...0 .... .... .... .... = IG bit: Individual address (unicast)
    Type: IPv4 (0x0800)
Internet Protocol Version 4, Src: 192.168.100.17, Dst: 142.104.71.81
Transmission Control Protocol, Src Port: 34880, Dst Port: 443, Seq: 1391, Ack: 1004, Len: 0

No.     Time           Source                Destination           Protocol Length Info
     17 0.624666000    Cisco_79:fd:00        Spanning-tree-(for-bridges)_00 STP      60     RST. Root = 8192/0/00:16:9c:b4:89:40  Cost = 1  Port = 0x8091

Frame 17: 60 bytes on wire (480 bits), 60 bytes captured (480 bits)
IEEE 802.3 Ethernet 
Logical-Link Control
Spanning Tree Protocol

No.     Time           Source                Destination           Protocol Length Info
     18 0.757215000    192.168.100.17        8.8.8.8               UDP      74     45344 → 33434 Len=32

Frame 18: 74 bytes on wire (592 bits), 74 bytes captured (592 bits)
Ethernet II, Src: Dell_0c:7f:fa (f0:4d:a2:0c:7f:fa), Dst: Netgear_6b:0d:fc (00:0f:b5:6b:0d:fc)
    Destination: Netgear_6b:0d:fc (00:0f:b5:6b:0d:fc)
        Address: Netgear_6b:0d:fc (00:0f:b5:6b:0d:fc)
        .... ..0. .... .... .... .... = LG bit: Globally unique address (factory default)
        .... ...0 .... .... .... .... = IG bit: Individual address (unicast)
    Source: Dell_0c:7f:fa (f0:4d:a2:0c:7f:fa)
        Address: Dell_0c:7f:fa (f0:4d:a2:0c:7f:fa)
        .... ..0. .... .... .... .... = LG bit: Globally unique address (factory default)
        .... ...0 .... .... .... .... = IG bit: Individual address (unicast)
    Type: IPv4 (0x0800)
Internet Protocol Version 4, Src: 192.168.100.17, Dst: 8.8.8.8
User Datagram Protocol, Src Port: 45344, Dst Port: 33434
Data (32 bytes)

0000  40 41 42 43 44 45 46 47 48 49 4a 4b 4c 4d 4e 4f   @ABCDEFGHIJKLMNO
0010  50 51 52 53 54 55 56 57 58 59 5a 5b 5c 5d 5e 5f   PQRSTUVWXYZ[\]^_

No.     Time           Source                Destination           Protocol Length Info
     19 0.757242000    192.168.100.17        8.8.8.8               UDP      74     48975 → 33435 Len=32

Frame 19: 74 bytes on wire (592 bits), 74 bytes captured (592 bits)
Ethernet II, Src: Dell_0c:7f:fa (f0:4d:a2:0c:7f:fa), Dst: Netgear_6b:0d:fc (00:0f:b5:6b:0d:fc)
    Destination: Netgear_6b:0d:fc (00:0f:b5:6b:0d:fc)
        Address: Netgear_6b:0d:fc (00:0f:b5:6b:0d:fc)
        .... ..0. .... .... .... .... = LG bit: Globally unique address (factory default)
        .... ...0 .... .... .... .... = IG bit: Individual address (unicast)
    Source: Dell_0c:7f:fa (f0:4d:a2:0c:7f:fa)
        Address: Dell_0c:7f:fa (f0:4d:a2:0c:7f:fa)
        .... ..0. .... .... .... .... = LG bit: Globally unique address (factory default)
        .... ...0 .... .... .... .... = IG bit: Individual address (unicast)
    Type: IPv4 (0x0800)
Internet Protocol Version 4, Src: 192.168.100.17, Dst: 8.8.8.8
User Datagram Protocol, Src Port: 48975, Dst Port: 33435
Data (32 bytes)

0000  40 41 42 43 44 45 46 47 48 49 4a 4b 4c 4d 4e 4f   @ABCDEFGHIJKLMNO
0010  50 51 52 53 54 55 56 57 58 59 5a 5b 5c 5d 5e 5f   PQRSTUVWXYZ[\]^_

No.     Time           Source                Destination           Protocol Length Info
     20 0.757258000    192.168.100.17        8.8.8.8               UDP      74     40110 → 33436 Len=32

Frame 20: 74 bytes on wire (592 bits), 74 bytes captured (592 bits)
Ethernet II, Src: Dell_0c:7f:fa (f0:4d:a2:0c:7f:fa), Dst: Netgear_6b:0d:fc (00:0f:b5:6b:0d:fc)
    Destination: Netgear_6b:0d:fc (00:0f:b5:6b:0d:fc)
        Address: Netgear_6b:0d:fc (00:0f:b5:6b:0d:fc)
        .... ..0. .... .... .... .... = LG bit: Globally unique address (factory default)
        .... ...0 .... .... .... .... = IG bit: Individual address (unicast)
    Source: Dell_0c:7f:fa (f0:4d:a2:0c:7f:fa)
        Address: Dell_0c:7f:fa (f0:4d:a2:0c:7f:fa)
        .... ..0. .... .... .... .... = LG bit: Globally unique address (factory default)
        .... ...0 .... .... .... .... = IG bit: Individual address (unicast)
    Type: IPv4 (0x0800)
Internet Protocol Version 4, Src: 192.168.100.17, Dst: 8.8.8.8
User Datagram Protocol, Src Port: 40110, Dst Port: 33436
Data (32 bytes)

0000  40 41 42 43 44 45 46 47 48 49 4a 4b 4c 4d 4e 4f   @ABCDEFGHIJKLMNO
0010  50 51 52 53 54 55 56 57 58 59 5a 5b 5c 5d 5e 5f   PQRSTUVWXYZ[\]^_

No.     Time           Source                Destination           Protocol Length Info
     21 0.757272000    192.168.100.17        8.8.8.8               UDP      74     46241 → 33437 Len=32

Frame 21: 74 bytes on wire (592 bits), 74 bytes captured (592 bits)
Ethernet II, Src: Dell_0c:7f:fa (f0:4d:a2:0c:7f:fa), Dst: Netgear_6b:0d:fc (00:0f:b5:6b:0d:fc)
    Destination: Netgear_6b:0d:fc (00:0f:b5:6b:0d:fc)
        Address: Netgear_6b:0d:fc (00:0f:b5:6b:0d:fc)
        .... ..0. .... .... .... .... = LG bit: Globally unique address (factory default)
        .... ...0 .... .... .... .... = IG bit: Individual address (unicast)
    Source: Dell_0c:7f:fa (f0:4d:a2:0c:7f:fa)
        Address: Dell_0c:7f:fa (f0:4d:a2:0c:7f:fa)
        .... ..0. .... .... .... .... = LG bit: Globally unique address (factory default)
        .... ...0 .... .... .... .... = IG bit: Individual address (unicast)
    Type: IPv4 (0x0800)
Internet Protocol Version 4, Src: 192.168.100.17, Dst: 8.8.8.8
User Datagram Protocol, Src Port: 46241, Dst Port: 33437
Data (32 bytes)

0000  40 41 42 43 44 45 46 47 48 49 4a 4b 4c 4d 4e 4f   @ABCDEFGHIJKLMNO
0010  50 51 52 53 54 55 56 57 58 59 5a 5b 5c 5d 5e 5f   PQRSTUVWXYZ[\]^_

No.     Time           Source                Destination           Protocol Length Info
     22 0.757286000    192.168.100.17        8.8.8.8               UDP      74     60688 → 33438 Len=32

Frame 22: 74 bytes on wire (592 bits), 74 bytes captured (592 bits)
Ethernet II, Src: Dell_0c:7f:fa (f0:4d:a2:0c:7f:fa), Dst: Netgear_6b:0d:fc (00:0f:b5:6b:0d:fc)
    Destination: Netgear_6b:0d:fc (00:0f:b5:6b:0d:fc)
        Address: Netgear_6b:0d:fc (00:0f:b5:6b:0d:fc)
        .... ..0. .... .... .... .... = LG bit: Globally unique address (factory default)
        .... ...0 .... .... .... .... = IG bit: Individual address (unicast)
    Source: Dell_0c:7f:fa (f0:4d:a2:0c:7f:fa)
        Address: Dell_0c:7f:fa (f0:4d:a2:0c:7f:fa)
        .... ..0. .... .... .... .... = LG bit: Globally unique address (factory default)
        .... ...0 .... .... .... .... = IG bit: Individual address (unicast)
    Type: IPv4 (0x0800)
Internet Protocol Version 4, Src: 192.168.100.17, Dst: 8.8.8.8
User Datagram Protocol, Src Port: 60688, Dst Port: 33438
Data (32 bytes)

0000  40 41 42 43 44 45 46 47 48 49 4a 4b 4c 4d 4e 4f   @ABCDEFGHIJKLMNO
0010  50 51 52 53 54 55 56 57 58 59 5a 5b 5c 5d 5e 5f   PQRSTUVWXYZ[\]^_

No.     Time           Source                Destination           Protocol Length Info
     23 0.757300000    192.168.100.17        8.8.8.8               UDP      74     45930 → 33439 Len=32

Frame 23: 74 bytes on wire (592 bits), 74 bytes captured (592 bits)
Ethernet II, Src: Dell_0c:7f:fa (f0:4d:a2:0c:7f:fa), Dst: Netgear_6b:0d:fc (00:0f:b5:6b:0d:fc)
    Destination: Netgear_6b:0d:fc (00:0f:b5:6b:0d:fc)
        Address: Netgear_6b:0d:fc (00:0f:b5:6b:0d:fc)
        .... ..0. .... .... .... .... = LG bit: Globally unique address (factory default)
        .... ...0 .... .... .... .... = IG bit: Individual address (unicast)
    Source: Dell_0c:7f:fa (f0:4d:a2:0c:7f:fa)
        Address: Dell_0c:7f:fa (f0:4d:a2:0c:7f:fa)
        .... ..0. .... .... .... .... = LG bit: Globally unique address (factory default)
        .... ...0 .... .... .... .... = IG bit: Individual address (unicast)
    Type: IPv4 (0x0800)
Internet Protocol Version 4, Src: 192.168.100.17, Dst: 8.8.8.8
User Datagram Protocol, Src Port: 45930, Dst Port: 33439
Data (32 bytes)

0000  40 41 42 43 44 45 46 47 48 49 4a 4b 4c 4d 4e 4f   @ABCDEFGHIJKLMNO
0010  50 51 52 53 54 55 56 57 58 59 5a 5b 5c 5d 5e 5f   PQRSTUVWXYZ[\]^_

No.     Time           Source                Destination           Protocol Length Info
     24 0.757313000    192.168.100.17        8.8.8.8               UDP      74     60038 → 33440 Len=32

Frame 24: 74 bytes on wire (592 bits), 74 bytes captured (592 bits)
Ethernet II, Src: Dell_0c:7f:fa (f0:4d:a2:0c:7f:fa), Dst: Netgear_6b:0d:fc (00:0f:b5:6b:0d:fc)
    Destination: Netgear_6b:0d:fc (00:0f:b5:6b:0d:fc)
        Address: Netgear_6b:0d:fc (00:0f:b5:6b:0d:fc)
        .... ..0. .... .... .... .... = LG bit: Globally unique address (factory default)
        .... ...0 .... .... .... .... = IG bit: Individual address (unicast)
    Source: Dell_0c:7f:fa (f0:4d:a2:0c:7f:fa)
        Address: Dell_0c:7f:fa (f0:4d:a2:0c:7f:fa)
        .... ..0. .... .... .... .... = LG bit: Globally unique address (factory default)
        .... ...0 .... .... .... .... = IG bit: Individual address (unicast)
    Type: IPv4 (0x0800)
Internet Protocol Version 4, Src: 192.168.100.17, Dst: 8.8.8.8
User Datagram Protocol, Src Port: 60038, Dst Port: 33440
Data (32 bytes)

0000  40 41 42 43 44 45 46 47 48 49 4a 4b 4c 4d 4e 4f   @ABCDEFGHIJKLMNO
0010  50 51 52 53 54 55 56 57 58 59 5a 5b 5c 5d 5e 5f   PQRSTUVWXYZ[\]^_

No.     Time           Source                Destination           Protocol Length Info
     25 0.757327000    192.168.100.17        8.8.8.8               UDP      74     48895 → 33441 Len=32

Frame 25: 74 bytes on wire (592 bits), 74 bytes captured (592 bits)
Ethernet II, Src: Dell_0c:7f:fa (f0:4d:a2:0c:7f:fa), Dst: Netgear_6b:0d:fc (00:0f:b5:6b:0d:fc)
    Destination: Netgear_6b:0d:fc (00:0f:b5:6b:0d:fc)
        Address: Netgear_6b:0d:fc (00:0f:b5:6b:0d:fc)
        .... ..0. .... .... .... .... = LG bit: Globally unique address (factory default)
        .... ...0 .... .... .... .... = IG bit: Individual address (unicast)
    Source: Dell_0c:7f:fa (f0:4d:a2:0c:7f:fa)
        Address: Dell_0c:7f:fa (f0:4d:a2:0c:7f:fa)
        .... ..0. .... .... .... .... = LG bit: Globally unique address (factory default)
        .... ...0 .... .... .... .... = IG bit: Individual address (unicast)
    Type: IPv4 (0x0800)
Internet Protocol Version 4, Src: 192.168.100.17, Dst: 8.8.8.8
User Datagram Protocol, Src Port: 48895, Dst Port: 33441
Data (32 bytes)

0000  40 41 42 43 44 45 46 47 48 49 4a 4b 4c 4d 4e 4f   @ABCDEFGHIJKLMNO
0010  50 51 52 53 54 55 56 57 58 59 5a 5b 5c 5d 5e 5f   PQRSTUVWXYZ[\]^_

No.     Time           Source                Destination           Protocol Length Info
     26 0.757340000    192.168.100.17        8.8.8.8               UDP      74     41564 → 33442 Len=32

Frame 26: 74 bytes on wire (592 bits), 74 bytes captured (592 bits)
Ethernet II, Src: Dell_0c:7f:fa (f0:4d:a2:0c:7f:fa), Dst: Netgear_6b:0d:fc (00:0f:b5:6b:0d:fc)
    Destination: Netgear_6b:0d:fc (00:0f:b5:6b:0d:fc)
        Address: Netgear_6b:0d:fc (00:0f:b5:6b:0d:fc)
        .... ..0. .... .... .... .... = LG bit: Globally unique address (factory default)
        .... ...0 .... .... .... .... = IG bit: Individual address (unicast)
    Source: Dell_0c:7f:fa (f0:4d:a2:0c:7f:fa)
        Address: Dell_0c:7f:fa (f0:4d:a2:0c:7f:fa)
        .... ..0. .... .... .... .... = LG bit: Globally unique address (factory default)
        .... ...0 .... .... .... .... = IG bit: Individual address (unicast)
    Type: IPv4 (0x0800)
Internet Protocol Version 4, Src: 192.168.100.17, Dst: 8.8.8.8
User Datagram Protocol, Src Port: 41564, Dst Port: 33442
Data (32 bytes)

0000  40 41 42 43 44 45 46 47 48 49 4a 4b 4c 4d 4e 4f   @ABCDEFGHIJKLMNO
0010  50 51 52 53 54 55 56 57 58 59 5a 5b 5c 5d 5e 5f   PQRSTUVWXYZ[\]^_

No.     Time           Source                Destination           Protocol Length Info
     27 0.757354000    192.168.100.17        8.8.8.8               UDP      74     42541 → 33443 Len=32

Frame 27: 74 bytes on wire (592 bits), 74 bytes captured (592 bits)
Ethernet II, Src: Dell_0c:7f:fa (f0:4d:a2:0c:7f:fa), Dst: Netgear_6b:0d:fc (00:0f:b5:6b:0d:fc)
    Destination: Netgear_6b:0d:fc (00:0f:b5:6b:0d:fc)
        Address: Netgear_6b:0d:fc (00:0f:b5:6b:0d:fc)
        .... ..0. .... .... .... .... = LG bit: Globally unique address (factory default)
        .... ...0 .... .... .... .... = IG bit: Individual address (unicast)
    Source: Dell_0c:7f:fa (f0:4d:a2:0c:7f:fa)
        Address: Dell_0c:7f:fa (f0:4d:a2:0c:7f:fa)
        .... ..0. .... .... .... .... = LG bit: Globally unique address (factory default)
        .... ...0 .... .... .... .... = IG bit: Individual address (unicast)
    Type: IPv4 (0x0800)
Internet Protocol Version 4, Src: 192.168.100.17, Dst: 8.8.8.8
User Datagram Protocol, Src Port: 42541, Dst Port: 33443
Data (32 bytes)

0000  40 41 42 43 44 45 46 47 48 49 4a 4b 4c 4d 4e 4f   @ABCDEFGHIJKLMNO
0010  50 51 52 53 54 55 56 57 58 59 5a 5b 5c 5d 5e 5f   PQRSTUVWXYZ[\]^_

No.     Time           Source                Destination           Protocol Length Info
     28 0.757367000    192.168.100.17        8.8.8.8               UDP      74     41326 → 33444 Len=32

Frame 28: 74 bytes on wire (592 bits), 74 bytes captured (592 bits)
Ethernet II, Src: Dell_0c:7f:fa (f0:4d:a2:0c:7f:fa), Dst: Netgear_6b:0d:fc (00:0f:b5:6b:0d:fc)
    Destination: Netgear_6b:0d:fc (00:0f:b5:6b:0d:fc)
        Address: Netgear_6b:0d:fc (00:0f:b5:6b:0d:fc)
        .... ..0. .... .... .... .... = LG bit: Globally unique address (factory default)
        .... ...0 .... .... .... .... = IG bit: Individual address (unicast)
    Source: Dell_0c:7f:fa (f0:4d:a2:0c:7f:fa)
        Address: Dell_0c:7f:fa (f0:4d:a2:0c:7f:fa)
        .... ..0. .... .... .... .... = LG bit: Globally unique address (factory default)
        .... ...0 .... .... .... .... = IG bit: Individual address (unicast)
    Type: IPv4 (0x0800)
Internet Protocol Version 4, Src: 192.168.100.17, Dst: 8.8.8.8
User Datagram Protocol, Src Port: 41326, Dst Port: 33444
Data (32 bytes)

0000  40 41 42 43 44 45 46 47 48 49 4a 4b 4c 4d 4e 4f   @ABCDEFGHIJKLMNO
0010  50 51 52 53 54 55 56 57 58 59 5a 5b 5c 5d 5e 5f   PQRSTUVWXYZ[\]^_

No.     Time           Source                Destination           Protocol Length Info
     29 0.757381000    192.168.100.17        8.8.8.8               UDP      74     38441 → 33445 Len=32

Frame 29: 74 bytes on wire (592 bits), 74 bytes captured (592 bits)
Ethernet II, Src: Dell_0c:7f:fa (f0:4d:a2:0c:7f:fa), Dst: Netgear_6b:0d:fc (00:0f:b5:6b:0d:fc)
    Destination: Netgear_6b:0d:fc (00:0f:b5:6b:0d:fc)
        Address: Netgear_6b:0d:fc (00:0f:b5:6b:0d:fc)
        .... ..0. .... .... .... .... = LG bit: Globally unique address (factory default)
        .... ...0 .... .... .... .... = IG bit: Individual address (unicast)
    Source: Dell_0c:7f:fa (f0:4d:a2:0c:7f:fa)
        Address: Dell_0c:7f:fa (f0:4d:a2:0c:7f:fa)
        .... ..0. .... .... .... .... = LG bit: Globally unique address (factory default)
        .... ...0 .... .... .... .... = IG bit: Individual address (unicast)
    Type: IPv4 (0x0800)
Internet Protocol Version 4, Src: 192.168.100.17, Dst: 8.8.8.8
User Datagram Protocol, Src Port: 38441, Dst Port: 33445
Data (32 bytes)

0000  40 41 42 43 44 45 46 47 48 49 4a 4b 4c 4d 4e 4f   @ABCDEFGHIJKLMNO
0010  50 51 52 53 54 55 56 57 58 59 5a 5b 5c 5d 5e 5f   PQRSTUVWXYZ[\]^_

No.     Time           Source                Destination           Protocol Length Info
     30 0.757394000    192.168.100.17        8.8.8.8               UDP      74     53293 → 33446 Len=32

Frame 30: 74 bytes on wire (592 bits), 74 bytes captured (592 bits)
Ethernet II, Src: Dell_0c:7f:fa (f0:4d:a2:0c:7f:fa), Dst: Netgear_6b:0d:fc (00:0f:b5:6b:0d:fc)
    Destination: Netgear_6b:0d:fc (00:0f:b5:6b:0d:fc)
        Address: Netgear_6b:0d:fc (00:0f:b5:6b:0d:fc)
        .... ..0. .... .... .... .... = LG bit: Globally unique address (factory default)
        .... ...0 .... .... .... .... = IG bit: Individual address (unicast)
    Source: Dell_0c:7f:fa (f0:4d:a2:0c:7f:fa)
        Address: Dell_0c:7f:fa (f0:4d:a2:0c:7f:fa)
        .... ..0. .... .... .... .... = LG bit: Globally unique address (factory default)
        .... ...0 .... .... .... .... = IG bit: Individual address (unicast)
    Type: IPv4 (0x0800)
Internet Protocol Version 4, Src: 192.168.100.17, Dst: 8.8.8.8
User Datagram Protocol, Src Port: 53293, Dst Port: 33446
Data (32 bytes)

0000  40 41 42 43 44 45 46 47 48 49 4a 4b 4c 4d 4e 4f   @ABCDEFGHIJKLMNO
0010  50 51 52 53 54 55 56 57 58 59 5a 5b 5c 5d 5e 5f   PQRSTUVWXYZ[\]^_

No.     Time           Source                Destination           Protocol Length Info
     31 0.757407000    192.168.100.17        8.8.8.8               UDP      74     59062 → 33447 Len=32

Frame 31: 74 bytes on wire (592 bits), 74 bytes captured (592 bits)
Ethernet II, Src: Dell_0c:7f:fa (f0:4d:a2:0c:7f:fa), Dst: Netgear_6b:0d:fc (00:0f:b5:6b:0d:fc)
    Destination: Netgear_6b:0d:fc (00:0f:b5:6b:0d:fc)
        Address: Netgear_6b:0d:fc (00:0f:b5:6b:0d:fc)
        .... ..0. .... .... .... .... = LG bit: Globally unique address (factory default)
        .... ...0 .... .... .... .... = IG bit: Individual address (unicast)
    Source: Dell_0c:7f:fa (f0:4d:a2:0c:7f:fa)
        Address: Dell_0c:7f:fa (f0:4d:a2:0c:7f:fa)
        .... ..0. .... .... .... .... = LG bit: Globally unique address (factory default)
        .... ...0 .... .... .... .... = IG bit: Individual address (unicast)
    Type: IPv4 (0x0800)
Internet Protocol Version 4, Src: 192.168.100.17, Dst: 8.8.8.8
User Datagram Protocol, Src Port: 59062, Dst Port: 33447
Data (32 bytes)

0000  40 41 42 43 44 45 46 47 48 49 4a 4b 4c 4d 4e 4f   @ABCDEFGHIJKLMNO
0010  50 51 52 53 54 55 56 57 58 59 5a 5b 5c 5d 5e 5f   PQRSTUVWXYZ[\]^_

No.     Time           Source                Destination           Protocol Length Info
     32 0.757421000    192.168.100.17        8.8.8.8               UDP      74     59977 → 33448 Len=32

Frame 32: 74 bytes on wire (592 bits), 74 bytes captured (592 bits)
Ethernet II, Src: Dell_0c:7f:fa (f0:4d:a2:0c:7f:fa), Dst: Netgear_6b:0d:fc (00:0f:b5:6b:0d:fc)
    Destination: Netgear_6b:0d:fc (00:0f:b5:6b:0d:fc)
        Address: Netgear_6b:0d:fc (00:0f:b5:6b:0d:fc)
        .... ..0. .... .... .... .... = LG bit: Globally unique address (factory default)
        .... ...0 .... .... .... .... = IG bit: Individual address (unicast)
    Source: Dell_0c:7f:fa (f0:4d:a2:0c:7f:fa)
        Address: Dell_0c:7f:fa (f0:4d:a2:0c:7f:fa)
        .... ..0. .... .... .... .... = LG bit: Globally unique address (factory default)
        .... ...0 .... .... .... .... = IG bit: Individual address (unicast)
    Type: IPv4 (0x0800)
Internet Protocol Version 4, Src: 192.168.100.17, Dst: 8.8.8.8
User Datagram Protocol, Src Port: 59977, Dst Port: 33448
Data (32 bytes)

0000  40 41 42 43 44 45 46 47 48 49 4a 4b 4c 4d 4e 4f   @ABCDEFGHIJKLMNO
0010  50 51 52 53 54 55 56 57 58 59 5a 5b 5c 5d 5e 5f   PQRSTUVWXYZ[\]^_

No.     Time           Source                Destination           Protocol Length Info
     33 0.757434000    192.168.100.17        8.8.8.8               UDP      74     43296 → 33449 Len=32

Frame 33: 74 bytes on wire (592 bits), 74 bytes captured (592 bits)
Ethernet II, Src: Dell_0c:7f:fa (f0:4d:a2:0c:7f:fa), Dst: Netgear_6b:0d:fc (00:0f:b5:6b:0d:fc)
    Destination: Netgear_6b:0d:fc (00:0f:b5:6b:0d:fc)
        Address: Netgear_6b:0d:fc (00:0f:b5:6b:0d:fc)
        .... ..0. .... .... .... .... = LG bit: Globally unique address (factory default)
        .... ...0 .... .... .... .... = IG bit: Individual address (unicast)
    Source: Dell_0c:7f:fa (f0:4d:a2:0c:7f:fa)
        Address: Dell_0c:7f:fa (f0:4d:a2:0c:7f:fa)
        .... ..0. .... .... .... .... = LG bit: Globally unique address (factory default)
        .... ...0 .... .... .... .... = IG bit: Individual address (unicast)
    Type: IPv4 (0x0800)
Internet Protocol Version 4, Src: 192.168.100.17, Dst: 8.8.8.8
User Datagram Protocol, Src Port: 43296, Dst Port: 33449
Data (32 bytes)

0000  40 41 42 43 44 45 46 47 48 49 4a 4b 4c 4d 4e 4f   @ABCDEFGHIJKLMNO
0010  50 51 52 53 54 55 56 57 58 59 5a 5b 5c 5d 5e 5f   PQRSTUVWXYZ[\]^_

No.     Time           Source                Destination           Protocol Length Info
     34 0.768327000    142.104.68.167        192.168.100.17        ICMP     70     Time-to-live exceeded (Time to live exceeded in transit)

Frame 34: 70 bytes on wire (560 bits), 70 bytes captured (560 bits)
Ethernet II, Src: Netgear_6b:0d:fc (00:0f:b5:6b:0d:fc), Dst: Dell_0c:7f:fa (f0:4d:a2:0c:7f:fa)
    Destination: Dell_0c:7f:fa (f0:4d:a2:0c:7f:fa)
        Address: Dell_0c:7f:fa (f0:4d:a2:0c:7f:fa)
        .... ..0. .... .... .... .... = LG bit: Globally unique address (factory default)
        .... ...0 .... .... .... .... = IG bit: Individual address (unicast)
    Source: Netgear_6b:0d:fc (00:0f:b5:6b:0d:fc)
        Address: Netgear_6b:0d:fc (00:0f:b5:6b:0d:fc)
        .... ..0. .... .... .... .... = LG bit: Globally unique address (factory default)
        .... ...0 .... .... .... .... = IG bit: Individual address (unicast)
    Type: IPv4 (0x0800)
Internet Protocol Version 4, Src: 142.104.68.167, Dst: 192.168.100.17
Internet Control Message Protocol

No.     Time           Source                Destination           Protocol Length Info
     35 0.768611000    142.104.68.167        192.168.100.17        ICMP     70     Time-to-live exceeded (Time to live exceeded in transit)

Frame 35: 70 bytes on wire (560 bits), 70 bytes captured (560 bits)
Ethernet II, Src: Netgear_6b:0d:fc (00:0f:b5:6b:0d:fc), Dst: Dell_0c:7f:fa (f0:4d:a2:0c:7f:fa)
    Destination: Dell_0c:7f:fa (f0:4d:a2:0c:7f:fa)
        Address: Dell_0c:7f:fa (f0:4d:a2:0c:7f:fa)
        .... ..0. .... .... .... .... = LG bit: Globally unique address (factory default)
        .... ...0 .... .... .... .... = IG bit: Individual address (unicast)
    Source: Netgear_6b:0d:fc (00:0f:b5:6b:0d:fc)
        Address: Netgear_6b:0d:fc (00:0f:b5:6b:0d:fc)
        .... ..0. .... .... .... .... = LG bit: Globally unique address (factory default)
        .... ...0 .... .... .... .... = IG bit: Individual address (unicast)
    Type: IPv4 (0x0800)
Internet Protocol Version 4, Src: 142.104.68.167, Dst: 192.168.100.17
Internet Control Message Protocol

No.     Time           Source                Destination           Protocol Length Info
